"title","category","category_slug","url","last_modified"
"4 Best HubSpot Marketing Alternatives for 2026","Marketing","marketing","https://saasstatshub.com/marketing/hubspot-marketing-alternatives/","2026-07-11T21:39:58"
"4 Best Semrush Alternatives for 2026","Marketing","marketing","https://saasstatshub.com/marketing/semrush-alternatives/","2026-07-11T21:39:31"
"5 Best Mailchimp Alternatives for 2026","Marketing","marketing","https://saasstatshub.com/marketing/mailchimp-alternatives/","2026-07-11T21:39:49"
"ActiveCampaign vs Klaviyo: Which Is Better in 2026?","Marketing","marketing","https://saasstatshub.com/marketing/activecampaign-vs-klaviyo/","2026-07-11T22:45:31"
"ActiveCampaign vs Mailchimp: Which Email Marketing Platform Is Better in 2026?","Marketing","marketing","https://saasstatshub.com/marketing/activecampaign-vs-mailchimp/","2026-07-11T22:13:32"
"Best ABM in 2026","Marketing","marketing","https://saasstatshub.com/marketing/best-abm-platforms/","2026-07-11T22:09:41"
"Best Affiliate Marketing Tools in 2026","Marketing","marketing","https://saasstatshub.com/marketing/best-affiliate-marketing-tools/","2026-07-11T21:52:48"
"Best Content Marketing Tools in 2026","Marketing","marketing","https://saasstatshub.com/marketing/best-content-marketing-tools/","2026-07-11T21:52:20"
"Best Email Marketing for Ecommerce in 2026","Marketing","marketing","https://saasstatshub.com/marketing/best-email-marketing-for-ecommerce/","2026-07-11T21:51:47"
"Best Email Marketing for Small Business in 2026","Marketing","marketing","https://saasstatshub.com/marketing/best-email-marketing-for-small-business/","2026-07-11T21:51:46"
"Best Email Marketing Software 2026","Marketing","marketing","https://saasstatshub.com/marketing/best-email-marketing-software/","2026-07-11T22:13:49"
"Best Email Marketing Software in 2026","Marketing","marketing","https://saasstatshub.com/marketing/best-email-marketing-platforms-2026/","2026-07-11T22:13:13"
"Best Free Email Marketing Tools in 2026","Marketing","marketing","https://saasstatshub.com/marketing/free-email-marketing-tools-2026/","2026-07-11T21:58:19"
"Best Landing Page Builders in 2026","Marketing","marketing","https://saasstatshub.com/marketing/best-landing-page-builders/","2026-07-11T22:13:03"
"Best Landing Page Builders in 2027: New Platforms","Marketing","marketing","https://saasstatshub.com/marketing/best-landing-page-builders-2027/","2026-07-11T21:51:28"
"Best Landing Page Optimization in 2026","Marketing","marketing","https://saasstatshub.com/marketing/best-landing-page-optimization-tools/","2026-07-11T22:08:50"
"Best Marketing Analytics Tools in 2026","Marketing","marketing","https://saasstatshub.com/marketing/best-marketing-analytics-tools/","2026-07-11T21:51:26"
"Best Marketing Attribution in 2026","Marketing","marketing","https://saasstatshub.com/marketing/best-marketing-attribution-tools/","2026-07-11T22:08:47"
"Best Marketing Automation for Enterprise in 2026","Marketing","marketing","https://saasstatshub.com/marketing/best-marketing-automation-for-enterprise/","2026-07-11T21:51:24"
"Best Marketing Automation for Startups in 2026","Marketing","marketing","https://saasstatshub.com/marketing/best-marketing-automation-for-startups/","2026-07-11T21:51:23"
"Best Marketing Automation Tools 2026","Marketing","marketing","https://saasstatshub.com/marketing/best-marketing-automation-tools/","2026-07-11T22:13:46"
"Best Marketing Automation Tools in 2026","Marketing","marketing","https://saasstatshub.com/marketing/best-marketing-automation-software-2026/","2026-07-11T22:13:02"
"Best Marketing Channels for Small Business","Marketing","marketing","https://saasstatshub.com/marketing/best-marketing-channels-for-small-business/","2026-07-11T22:01:22"
"Best Marketing Tools for Nonprofits in 2026","Marketing","marketing","https://saasstatshub.com/marketing/best-marketing-tools-for-nonprofits/","2026-07-11T21:51:22"
"Best Marketing Tools for Real Estate in 2026","Marketing","marketing","https://saasstatshub.com/marketing/best-marketing-tools-for-real-estate/","2026-07-11T21:51:21"
"Best Marketing Tools for SaaS in 2026","Marketing","marketing","https://saasstatshub.com/marketing/best-marketing-tools-for-saas/","2026-07-11T21:51:20"
"Best Podcast Hosting in 2026","Marketing","marketing","https://saasstatshub.com/marketing/best-podcast-hosting-platforms/","2026-07-11T22:08:45"
"Best PPC Management Tools in 2026","Marketing","marketing","https://saasstatshub.com/marketing/best-ppc-management-tools/","2026-07-11T21:51:11"
"Best SEO Tool for Agencies in 2026","Marketing","marketing","https://saasstatshub.com/marketing/best-seo-tool-for-agencies/","2026-07-11T21:50:52"
"Best SEO Tool for Beginners in 2026","Marketing","marketing","https://saasstatshub.com/marketing/best-seo-tool-for-beginners/","2026-07-11T21:50:51"
"Best Social Media Management Tools in 2026","Marketing","marketing","https://saasstatshub.com/marketing/best-social-media-management-tools/","2026-07-11T22:12:55"
"Best Social Media Tool for Small Business in 2026","Marketing","marketing","https://saasstatshub.com/marketing/best-social-media-tool-for-small-business/","2026-07-11T21:50:48"
"Brand Guidelines: Document Template","Marketing","marketing","https://saasstatshub.com/marketing/brand-guidelines-template/","2026-07-11T22:01:12"
"Communication Statistics 2026: Messaging Apps, Email Volume, and Global Connectivity Trends","Marketing","marketing","https://saasstatshub.com/marketing/communication-statistics-2026/","2026-07-11T22:14:11"
"Content Calendar: Planning Template","Marketing","marketing","https://saasstatshub.com/marketing/content-calendar-template/","2026-07-11T22:00:26"
"Content Marketing Statistics 2026: AI Adoption and Platform Data","Marketing","marketing","https://saasstatshub.com/marketing/content-marketing-statistics-2026/","2026-07-11T22:14:50"
"Content Marketing vs SEO: Key Differences","Marketing","marketing","https://saasstatshub.com/marketing/content-marketing-vs-seo/","2026-07-11T22:00:25"
"Customer Experience Statistics 2026: AI, Trust, Feedback, and Service Expectations","Marketing","marketing","https://saasstatshub.com/marketing/customer-experience-statistics-2026/","2026-07-11T22:18:27"
"Email Marketing Best Practices 2026","Marketing","marketing","https://saasstatshub.com/marketing/email-marketing-best-practices-2026/","2026-07-11T21:58:57"
"Email Marketing Statistics 2026: Channel Use, AI Workflows and Mobile Data","Marketing","marketing","https://saasstatshub.com/marketing/email-marketing-statistics-2026/","2026-07-11T22:14:46"
"Email Marketing: Campaign Checklist","Marketing","marketing","https://saasstatshub.com/marketing/email-marketing-checklist/","2026-07-11T21:58:56"
"How Email Marketing Works: Complete Guide","Marketing","marketing","https://saasstatshub.com/marketing/how-email-marketing-works-complete-guide/","2026-07-11T21:57:35"
"How to Automate Marketing in 2026","Marketing","marketing","https://saasstatshub.com/marketing/how-to-automate-marketing/","2026-07-11T22:12:44"
"How to Build a Marketing Funnel in 2026","Marketing","marketing","https://saasstatshub.com/marketing/how-to-build-marketing-funnel/","2026-07-11T22:12:42"
"How to Build Affiliate Program in 2026: A Complete Guide","Marketing","marketing","https://saasstatshub.com/marketing/how-to-build-affiliate-program/","2026-07-11T22:07:56"
"How to Build Short Form Video Strategy in 2026: A Complete Guide","Marketing","marketing","https://saasstatshub.com/marketing/how-to-build-short-form-video-strategy/","2026-07-11T22:07:44"
"How to Create a Marketing Budget","Marketing","marketing","https://saasstatshub.com/marketing/how-to-create-marketing-budget/","2026-07-11T21:57:27"
"How to Create Marketing Attribution Model in 2026: A Complete Guide","Marketing","marketing","https://saasstatshub.com/marketing/how-to-create-marketing-attribution-model/","2026-07-11T22:07:35"
"How to Create Podcast Marketing Strategy in 2026: A Complete Guide","Marketing","marketing","https://saasstatshub.com/marketing/how-to-create-podcast-marketing-strategy/","2026-07-11T22:07:34"
"How to Implement ABM in 2026: A Complete Guide","Marketing","marketing","https://saasstatshub.com/marketing/how-to-implement-account-based-marketing/","2026-07-11T22:07:27"
"How to Implement ABM Strategy in 2026: A Complete Guide","Marketing","marketing","https://saasstatshub.com/marketing/how-to-implement-abm-strategy/","2026-07-11T22:07:29"
"How to Implement Marketing Automation in 2026","Marketing","marketing","https://saasstatshub.com/marketing/how-to-implement-marketing-automation/","2026-07-11T22:12:22"
"How to Reduce Customer Acquisition Cost in 2026","Marketing","marketing","https://saasstatshub.com/marketing/how-to-reduce-customer-acquisition-cost/","2026-07-11T22:12:13"
"HubSpot Marketing Hub vs ActiveCampaign 2026","Marketing","marketing","https://saasstatshub.com/marketing/hubspot-marketing-hub-vs-activecampaign/","2026-07-11T22:13:52"
"HubSpot vs Keap: Which Is Better in 2026?","Marketing","marketing","https://saasstatshub.com/marketing/hubspot-vs-keap/","2026-07-11T22:44:59"
"HubSpot vs Marketo: Which Is Better in 2026?","Marketing","marketing","https://saasstatshub.com/marketing/hubspot-vs-marketo/","2026-07-11T22:45:58"
"HubSpot vs Salesforce Marketing Cloud: Which Marketing Platform Is Better in 2026?","Marketing","marketing","https://saasstatshub.com/marketing/hubspot-vs-salesforce-marketing/","2026-07-11T22:12:08"
"Inbound Marketing Strategy Guide 2026","Marketing","marketing","https://saasstatshub.com/marketing/inbound-marketing-strategy-2026/","2026-07-11T21:57:18"
"Lead Generation: Checklist Template","Marketing","marketing","https://saasstatshub.com/marketing/lead-generation-checklist/","2026-07-11T21:56:47"
"Mailchimp vs ActiveCampaign vs Klaviyo 2026","Marketing","marketing","https://saasstatshub.com/marketing/mailchimp-vs-activecampaign-vs-klaviyo/","2026-07-11T22:14:05"
"Mailchimp vs Brevo: Which Is Better in 2026?","Marketing","marketing","https://saasstatshub.com/marketing/mailchimp-vs-sendinblue/","2026-07-11T22:45:54"
"Mailchimp vs Constant Contact: Which Email Marketing Tool Wins in 2026?","Marketing","marketing","https://saasstatshub.com/marketing/mailchimp-vs-constant-contact/","2026-07-11T22:12:04"
"Mailchimp vs ConvertKit: Which Is Better in 2026?","Marketing","marketing","https://saasstatshub.com/marketing/mailchimp-vs-convertkit/","2026-07-11T22:44:54"
"Marketing Attribution: Complete Guide","Marketing","marketing","https://saasstatshub.com/marketing/marketing-attribution-guide/","2026-07-11T21:56:30"
"Marketing Automation for Small Business","Marketing","marketing","https://saasstatshub.com/marketing/marketing-automation-for-small-business/","2026-07-11T21:56:29"
"Marketing Automation Statistics 2026: Adoption, AI and Workflow Trends","Marketing","marketing","https://saasstatshub.com/marketing/marketing-automation-statistics-2026/","2026-07-11T22:18:33"
"Marketing Budget Breakdown: How to Allocate","Marketing","marketing","https://saasstatshub.com/marketing/marketing-budget-breakdown-2026/","2026-07-11T21:56:28"
"Marketing Budget: Spreadsheet Template","Marketing","marketing","https://saasstatshub.com/marketing/marketing-budget-template/","2026-07-11T21:56:26"
"Marketing Calendar: Planning Template","Marketing","marketing","https://saasstatshub.com/marketing/marketing-calendar-template/","2026-07-11T21:56:25"
"Marketing Campaign: Planning Template","Marketing","marketing","https://saasstatshub.com/marketing/marketing-campaign-template/","2026-07-11T21:56:24"
"Marketing Funnel Stages Explained","Marketing","marketing","https://saasstatshub.com/marketing/marketing-funnel-stages-explained/","2026-07-11T21:56:23"
"Marketing KPIs: Essential Metrics to Track","Marketing","marketing","https://saasstatshub.com/marketing/marketing-kpis-to-track/","2026-07-11T21:56:21"
"Marketing Report: Monthly Template","Marketing","marketing","https://saasstatshub.com/marketing/marketing-report-template/","2026-07-11T21:56:20"
"Marketing Tech Stack: Building Your Arsenal","Marketing","marketing","https://saasstatshub.com/marketing/marketing-tech-stack-2026/","2026-07-11T21:56:19"
"Marketing Technology Trends 2027","Marketing","marketing","https://saasstatshub.com/marketing/marketing-technology-trends-2027/","2026-07-11T21:56:17"
"SaaS Pricing Statistics 2026: Usage-Based, Hybrid and Subscription Models","Marketing","marketing","https://saasstatshub.com/marketing/saas-pricing-statistics-2026/","2026-07-11T22:14:59"
"Semrush vs Ahrefs: Which SEO Tool Is Better in 2026?","Marketing","marketing","https://saasstatshub.com/marketing/semrush-vs-ahrefs/","2026-07-11T22:11:54"
"Semrush vs Moz: Which Is Better in 2026?","Marketing","marketing","https://saasstatshub.com/marketing/semrush-vs-moz/","2026-07-11T22:45:47"
"Semrush vs Serpstat: Which Is Better in 2026?","Marketing","marketing","https://saasstatshub.com/marketing/semrush-vs-serpstat/","2026-07-11T22:44:38"
"Semrush vs SpyFu: Which Is Better in 2026?","Marketing","marketing","https://saasstatshub.com/marketing/semrush-vs-spyfu/","2026-07-11T22:44:37"
"SEO Audit: Complete Checklist","Marketing","marketing","https://saasstatshub.com/marketing/seo-audit-checklist/","2026-07-11T21:54:20"
"Social Media Calendar: Template","Marketing","marketing","https://saasstatshub.com/marketing/social-media-calendar/","2026-07-11T21:54:14"
"Social Media Marketing ROI: How to Measure","Marketing","marketing","https://saasstatshub.com/marketing/social-media-marketing-roi/","2026-07-11T21:54:13"
"Social Media Marketing Statistics 2026: Verified Audience and Channel Data","Marketing","marketing","https://saasstatshub.com/marketing/social-media-marketing-statistics-2026/","2026-07-11T22:14:37"
"The Ultimate Guide to Marketing Technology (MarTech) in 2026","Marketing","marketing","https://saasstatshub.com/marketing/marketing-technology-guide/","2026-07-11T21:50:24"
"What Is Brand Positioning?","Marketing","marketing","https://saasstatshub.com/marketing/what-is-brand-positioning/","2026-07-11T21:49:37"
"What Is Content Marketing?","Marketing","marketing","https://saasstatshub.com/marketing/what-is-content-marketing/","2026-07-11T21:48:36"
"What Is Content Syndication?","Marketing","marketing","https://saasstatshub.com/marketing/what-is-content-syndication/","2026-07-11T21:48:35"
"What Is Conversion Rate Optimization?","Marketing","marketing","https://saasstatshub.com/marketing/what-is-conversion-rate-optimization/","2026-07-11T21:48:30"
"What Is Customer Acquisition Cost?","Marketing","marketing","https://saasstatshub.com/marketing/what-is-customer-acquisition-cost/","2026-07-11T21:48:19"
"What Is Email Marketing?","Marketing","marketing","https://saasstatshub.com/marketing/what-is-email-marketing/","2026-07-11T21:46:49"
"What Is Growth Hacking?","Marketing","marketing","https://saasstatshub.com/marketing/what-is-growth-hacking/","2026-07-11T21:46:07"
"What Is Guerilla Marketing?","Marketing","marketing","https://saasstatshub.com/marketing/what-is-guerilla-marketing/","2026-07-11T21:46:06"
"What Is Influencer Marketing?","Marketing","marketing","https://saasstatshub.com/marketing/what-is-influencer-marketing/","2026-07-11T21:45:34"
"What Is Landing Page Builder?","Marketing","marketing","https://saasstatshub.com/marketing/what-is-landing-page-builder/","2026-07-11T21:45:13"
"What Is Lead Generation?","Marketing","marketing","https://saasstatshub.com/marketing/what-is-lead-generation/","2026-07-11T21:45:10"
"What Is Marketing Analytics?","Marketing","marketing","https://saasstatshub.com/marketing/what-is-marketing-analytics/","2026-07-11T21:44:45"
"What Is Marketing Attribution?","Marketing","marketing","https://saasstatshub.com/marketing/what-is-marketing-attribution/","2026-07-11T21:44:43"
"What Is Marketing Automation and How Does It Work?","Marketing","marketing","https://saasstatshub.com/marketing/what-is-marketing-automation-and-how-does-it-work/","2026-07-11T21:53:05"
"What Is Marketing Automation?","Marketing","marketing","https://saasstatshub.com/marketing/what-is-marketing-automation/","2026-07-11T21:44:42"
"What Is Marketing Compliance?","Marketing","marketing","https://saasstatshub.com/marketing/what-is-marketing-compliance/","2026-07-11T21:44:41"
"What Is Marketing Funnel Optimization?","Marketing","marketing","https://saasstatshub.com/marketing/what-is-marketing-funnel-optimization/","2026-07-11T21:44:40"
"What Is Marketing Funnel?","Marketing","marketing","https://saasstatshub.com/marketing/what-is-marketing-funnel/","2026-07-11T21:44:38"
"What Is Marketing Operations (Marketing)?","Marketing","marketing","https://saasstatshub.com/marketing/what-is-marketing-operations-marketing/","2026-07-11T21:44:37"
"What Is Marketing Operations?","Marketing","marketing","https://saasstatshub.com/marketing/what-is-marketing-operations/","2026-07-11T21:44:36"
"What Is Marketing Qualified Lead?","Marketing","marketing","https://saasstatshub.com/marketing/what-is-marketing-qualified-lead/","2026-07-11T21:44:35"
"What Is MQL?","Marketing","marketing","https://saasstatshub.com/marketing/what-is-mql/","2026-07-11T21:44:14"
"What Is Pay-Per-Click Advertising?","Marketing","marketing","https://saasstatshub.com/marketing/what-is-pay-per-click-advertising/","2026-07-11T21:43:47"
"What Is Pay-Per-Click?","Marketing","marketing","https://saasstatshub.com/marketing/what-is-pay-per-click/","2026-07-11T21:43:46"
"What Is SEO Tools?","Marketing","marketing","https://saasstatshub.com/marketing/what-is-seo-tools/","2026-07-11T21:41:52"
"What Is SEO?","Marketing","marketing","https://saasstatshub.com/marketing/what-is-seo/","2026-07-11T21:41:51"
"What Is Social Media Marketing?","Marketing","marketing","https://saasstatshub.com/marketing/what-is-social-media-marketing/","2026-07-11T21:41:42"
"What Is Video Marketing?","Marketing","marketing","https://saasstatshub.com/marketing/what-is-video-marketing/","2026-07-11T21:40:56"
"What Is Webinar Platform?","Marketing","marketing","https://saasstatshub.com/marketing/what-is-webinar-platform/","2026-07-11T21:40:37"
"Best Donor Management in 2026","Nonprofit","nonprofit","https://saasstatshub.com/nonprofit/best-donor-management-software/","2026-07-11T22:05:37"
"Best Free Nonprofit Software in 2026","Nonprofit","nonprofit","https://saasstatshub.com/nonprofit/free-nonprofit-software-2026/","2026-07-11T21:58:09"
"Best Fundraising in 2026","Nonprofit","nonprofit","https://saasstatshub.com/nonprofit/best-fundraising-tools/","2026-07-11T22:05:22"
"Best Nonprofit Accounting in 2026","Nonprofit","nonprofit","https://saasstatshub.com/nonprofit/best-nonprofit-accounting-software/","2026-07-11T22:05:02"
"Best Nonprofit CRM in 2026","Nonprofit","nonprofit","https://saasstatshub.com/nonprofit/best-nonprofit-crm/","2026-07-11T22:05:00"
"Best Volunteer Management in 2026","Nonprofit","nonprofit","https://saasstatshub.com/nonprofit/best-volunteer-management-software/","2026-07-11T22:04:36"
"Board Management: Essential Tools","Nonprofit","nonprofit","https://saasstatshub.com/nonprofit/board-management-tools/","2026-07-11T22:01:13"
"Classy vs GoFundMe: Which Is Better in 2026?","Nonprofit","nonprofit","https://saasstatshub.com/nonprofit/classy-vs-gofundme/","2026-07-11T22:44:11"
"Donor Management Software Guide","Nonprofit","nonprofit","https://saasstatshub.com/nonprofit/donor-management-software-guide/","2026-07-11T21:59:31"
"Donor Retention: Strategies That Work","Nonprofit","nonprofit","https://saasstatshub.com/nonprofit/donor-retention-strategies/","2026-07-11T21:59:30"
"Fundraising Events: Planning Guide","Nonprofit","nonprofit","https://saasstatshub.com/nonprofit/fundraising-event-planning/","2026-07-11T21:58:00"
"Fundraising Platforms Comparison","Nonprofit","nonprofit","https://saasstatshub.com/nonprofit/fundraising-platforms-comparison/","2026-07-11T21:57:59"
"Givebutter vs Classy: Which Is Better in 2026?","Nonprofit","nonprofit","https://saasstatshub.com/nonprofit/givebutter-vs-classy/","2026-07-11T22:43:53"
"How to Choose Nonprofit CRM in 2026: A Complete Guide","Nonprofit","nonprofit","https://saasstatshub.com/nonprofit/how-to-choose-nonprofit-crm/","2026-07-11T22:03:43"
"How to Implement Donor Management in 2026: A Complete Guide","Nonprofit","nonprofit","https://saasstatshub.com/nonprofit/how-to-implement-donor-management/","2026-07-11T22:03:30"
"How to Implement Nonprofit Accounting in 2026: A Complete Guide","Nonprofit","nonprofit","https://saasstatshub.com/nonprofit/how-to-implement-nonprofit-accounting/","2026-07-11T22:03:23"
"How to Manage Volunteers in 2026: A Complete Guide","Nonprofit","nonprofit","https://saasstatshub.com/nonprofit/how-to-manage-volunteers/","2026-07-11T22:03:12"
"How to Set Up Fundraising Campaign in 2026: A Complete Guide","Nonprofit","nonprofit","https://saasstatshub.com/nonprofit/how-to-set-up-fundraising-campaign/","2026-07-11T22:03:04"
"Little Green Light vs Bloomerang: Which Is Better in 2026?","Nonprofit","nonprofit","https://saasstatshub.com/nonprofit/little-green-light-vs-bloomerang/","2026-07-11T22:43:41"
"Neon CRM vs DonorPerfect: Which Is Better in 2026?","Nonprofit","nonprofit","https://saasstatshub.com/nonprofit/neon-crm-vs-donorperfect/","2026-07-11T22:43:38"
"Nonprofit Financial: Management Guide","Nonprofit","nonprofit","https://saasstatshub.com/nonprofit/nonprofit-financial-management/","2026-07-11T21:56:07"
"Nonprofit Grant Management Guide","Nonprofit","nonprofit","https://saasstatshub.com/nonprofit/nonprofit-grant-management-guide/","2026-07-11T21:56:06"
"Nonprofit Grant Management: Complete Guide","Nonprofit","nonprofit","https://saasstatshub.com/nonprofit/nonprofit-grant-management/","2026-07-11T21:56:05"
"Nonprofit Impact: Measurement Guide","Nonprofit","nonprofit","https://saasstatshub.com/nonprofit/nonprofit-impact-measurement/","2026-07-11T21:56:03"
"Nonprofit Marketing: Getting Started Guide","Nonprofit","nonprofit","https://saasstatshub.com/nonprofit/nonprofit-marketing-guide/","2026-07-11T21:56:02"
"Nonprofit Sustainability: Strategies","Nonprofit","nonprofit","https://saasstatshub.com/nonprofit/nonprofit-sustainability-guide/","2026-07-11T21:56:00"
"Nonprofit Tech Stack: Building Your Arsenal","Nonprofit","nonprofit","https://saasstatshub.com/nonprofit/nonprofit-tech-stack/","2026-07-11T21:55:59"
"Salesforce Nonprofit vs Bloomerang: Which Is Better in 2026?","Nonprofit","nonprofit","https://saasstatshub.com/nonprofit/salesforce-nonprofit-vs-bloomerang/","2026-07-11T22:43:24"
"The Ultimate Guide to Nonprofit Technology in 2026","Nonprofit","nonprofit","https://saasstatshub.com/nonprofit/nonprofit-technology-guide/","2026-07-11T21:50:24"
"Volunteer Management Tools","Nonprofit","nonprofit","https://saasstatshub.com/nonprofit/volunteer-management-tools/","2026-07-11T21:53:31"
"Volunteer Recruitment: Effective Guide","Nonprofit","nonprofit","https://saasstatshub.com/nonprofit/volunteer-recruitment-guide/","2026-07-11T21:53:29"
"What Is Advocacy Software?","Nonprofit","nonprofit","https://saasstatshub.com/nonprofit/what-is-advocacy-software/","2026-07-11T21:50:06"
"What Is Board Management?","Nonprofit","nonprofit","https://saasstatshub.com/nonprofit/what-is-board-management/","2026-07-11T21:49:38"
"What Is Donor Communication?","Nonprofit","nonprofit","https://saasstatshub.com/nonprofit/what-is-donor-communication/","2026-07-11T21:47:25"
"What Is Donor Management?","Nonprofit","nonprofit","https://saasstatshub.com/nonprofit/what-is-donor-management/","2026-07-11T21:47:23"
"What Is Fundraising Software?","Nonprofit","nonprofit","https://saasstatshub.com/nonprofit/what-is-fundraising-software/","2026-07-11T21:46:16"
"What Is Grant Management?","Nonprofit","nonprofit","https://saasstatshub.com/nonprofit/what-is-grant-management/","2026-07-11T21:46:08"
"What Is Impact Measurement?","Nonprofit","nonprofit","https://saasstatshub.com/nonprofit/what-is-impact-measurement/","2026-07-11T21:45:36"
"What Is Membership Management?","Nonprofit","nonprofit","https://saasstatshub.com/nonprofit/what-is-membership-management/","2026-07-11T21:44:24"
"What Is Nonprofit Accounting?","Nonprofit","nonprofit","https://saasstatshub.com/nonprofit/what-is-nonprofit-accounting/","2026-07-11T21:44:10"
"What Is Nonprofit Compliance?","Nonprofit","nonprofit","https://saasstatshub.com/nonprofit/what-is-nonprofit-compliance/","2026-07-11T21:44:09"
"What Is Nonprofit CRM?","Nonprofit","nonprofit","https://saasstatshub.com/nonprofit/what-is-nonprofit-crm/","2026-07-11T21:53:03"
"What Is Nonprofit CRM? A 2027 Guide","Nonprofit","nonprofit","https://saasstatshub.com/nonprofit/what-is-nonprofit-crm-2027/","2026-07-11T21:44:08"
"What Is Nonprofit Data?","Nonprofit","nonprofit","https://saasstatshub.com/nonprofit/what-is-nonprofit-data/","2026-07-11T21:44:06"
"What Is Nonprofit Marketing?","Nonprofit","nonprofit","https://saasstatshub.com/nonprofit/what-is-nonprofit-marketing/","2026-07-11T21:44:05"
"What Is Program Management?","Nonprofit","nonprofit","https://saasstatshub.com/nonprofit/what-is-program-management/","2026-07-11T21:43:16"
"What Is Volunteer Management?","Nonprofit","nonprofit","https://saasstatshub.com/nonprofit/what-is-volunteer-management/","2026-07-11T21:40:47"
"3 Best Basecamp Alternatives for 2026","Project Management","project-management","https://saasstatshub.com/project-management/basecamp-alternatives/","2026-07-11T21:40:21"
"3 Best ClickUp Alternatives for 2026","Project Management","project-management","https://saasstatshub.com/project-management/clickup-alternatives/","2026-07-11T21:40:17"
"3 Best Wrike Alternatives for 2026","Project Management","project-management","https://saasstatshub.com/project-management/wrike-alternatives/","2026-07-11T22:42:34"
"4 Best Jira Alternatives for 2026","Project Management","project-management","https://saasstatshub.com/project-management/jira-alternatives/","2026-07-11T22:42:52"
