"title","category","category_slug","url","last_modified"
"Best CRM for Startups in 2026","CRM","crm","https://saasstatshub.com/crm/best-crm-for-startups/","2026-07-11T22:13:19"
"Best CRM for Startups in 2027: Growth-Stage Tools","CRM","crm","https://saasstatshub.com/crm/best-crm-for-startups-2027/","2026-07-11T21:52:02"
"Best CRM Integration in 2026","CRM","crm","https://saasstatshub.com/crm/best-crm-integration-platforms/","2026-07-11T22:09:17"
"Best CRM Software in 2026","CRM","crm","https://saasstatshub.com/crm/best-crm-software/","2026-07-11T22:13:18"
"Best Customer Success Software in 2026","CRM","crm","https://saasstatshub.com/crm/best-customer-success-software/","2026-07-11T22:11:22"
"Best Enterprise CRM in 2026","CRM","crm","https://saasstatshub.com/crm/best-crm-for-enterprise/","2026-07-11T22:09:19"
"Best Free CRM Tools in 2026","CRM","crm","https://saasstatshub.com/crm/free-crm-tools-2026/","2026-07-11T21:58:24"
"Best Open Source CRM in 2026","CRM","crm","https://saasstatshub.com/crm/best-open-source-crm/","2026-07-11T22:11:10"
"Cloud CRM vs On-Premise: Which to Choose","CRM","crm","https://saasstatshub.com/crm/cloud-crm-vs-on-premise/","2026-07-11T22:00:55"
"CRM Adoption by Industry Statistics 2026: Verified Disclosure Limits","CRM","crm","https://saasstatshub.com/crm/crm-adoption-by-industry-statistics-2026/","2026-07-11T22:14:26"
"CRM Analytics Statistics 2026: Verified Reporting Signals and Limits","CRM","crm","https://saasstatshub.com/crm/crm-analytics-statistics-2026/","2026-07-11T22:14:20"
"CRM Automation: Complete Guide","CRM","crm","https://saasstatshub.com/crm/crm-automation-guide/","2026-07-11T22:00:19"
"CRM Data Migration: Checklist Template","CRM","crm","https://saasstatshub.com/crm/crm-data-migration-checklist/","2026-07-11T22:00:18"
"CRM Data Migration: Complete Guide","CRM","crm","https://saasstatshub.com/crm/crm-data-migration-guide/","2026-07-11T22:00:17"
"CRM Evaluation Checklist: Complete Template","CRM","crm","https://saasstatshub.com/crm/crm-evaluation-checklist/","2026-07-11T22:00:16"
"CRM for Real Estate Statistics 2026: Verified Workflow Signals and Limits","CRM","crm","https://saasstatshub.com/crm/crm-for-real-estate-statistics-2026/","2026-07-11T22:14:19"
"CRM for Startups: Essential Guide","CRM","crm","https://saasstatshub.com/crm/crm-for-startups-2026/","2026-07-11T22:00:15"
"CRM Implementation Statistics 2026: Verified Migration Limits and Disclosure Boundaries","CRM","crm","https://saasstatshub.com/crm/crm-implementation-statistics-2026/","2026-07-11T22:14:28"
"CRM Implementation Timeline: Project Plan","CRM","crm","https://saasstatshub.com/crm/crm-implementation-timeline/","2026-07-11T22:00:14"
"CRM Integration Guide: Connecting Your Systems","CRM","crm","https://saasstatshub.com/crm/crm-integration-guide-2026/","2026-07-11T22:00:13"
"CRM Integration Planning: Template","CRM","crm","https://saasstatshub.com/crm/crm-integration-planning-template/","2026-07-11T22:00:12"
"CRM Integration Statistics 2026: Verified Ecosystem Signals and Limits","CRM","crm","https://saasstatshub.com/crm/crm-integration-statistics-2026/","2026-07-11T22:14:21"
"CRM Migration Checklist: Step-by-Step","CRM","crm","https://saasstatshub.com/crm/crm-migration-checklist-2026/","2026-07-11T22:00:11"
"CRM Requirements: Document Template","CRM","crm","https://saasstatshub.com/crm/crm-requirements-document/","2026-07-11T22:00:09"
"CRM ROI Calculator: Measure Your Returns","CRM","crm","https://saasstatshub.com/crm/crm-roi-calculator/","2026-07-11T22:00:08"
"CRM ROI Calculator: Spreadsheet Template","CRM","crm","https://saasstatshub.com/crm/crm-roi-calculator-template/","2026-07-11T22:00:08"
"CRM ROI Statistics 2026: Verified Payback Signals and Disclosure Limits","CRM","crm","https://saasstatshub.com/crm/crm-roi-statistics-2026/","2026-07-11T22:14:24"
"CRM Software Statistics 2026: Platform Data and Disclosure Limits","CRM","crm","https://saasstatshub.com/crm/crm-software-statistics-2026/","2026-07-11T22:14:49"
"CRM Success Metrics: Tracking Template","CRM","crm","https://saasstatshub.com/crm/crm-success-metrics-template/","2026-07-11T22:00:06"
"CRM Training Plan: Complete Template","CRM","crm","https://saasstatshub.com/crm/crm-training-plan-template/","2026-07-11T22:00:05"
"CRM User Adoption: Checklist Template","CRM","crm","https://saasstatshub.com/crm/crm-user-adoption-checklist/","2026-07-11T22:00:04"
"CRM Vendor Comparison: Evaluation Template","CRM","crm","https://saasstatshub.com/crm/crm-vendor-comparison-template/","2026-07-11T22:00:03"
"CRM vs ERP: Understanding the Difference","CRM","crm","https://saasstatshub.com/crm/crm-vs-erp-difference/","2026-07-11T22:00:01"
"CRM vs ERP: What’s the Difference?","CRM","crm","https://saasstatshub.com/crm/crm-vs-erp-whats-the-difference/","2026-07-11T22:00:00"
"Freshsales Statistics 2026: Verified Freshworks CRM Signals and Limits","CRM","crm","https://saasstatshub.com/crm/freshsales-statistics-2026/","2026-07-11T22:14:29"
"Freshsales vs HubSpot: Which Is Better in 2026?","CRM","crm","https://saasstatshub.com/crm/freshsales-vs-hubspot/","2026-07-11T22:45:08"
"How Long Does CRM Implementation Take?","CRM","crm","https://saasstatshub.com/crm/how-long-does-crm-implementation-take/","2026-07-11T21:57:32"
"How to Build a Sales Pipeline in 2026","CRM","crm","https://saasstatshub.com/crm/how-to-build-sales-pipeline/","2026-07-11T22:12:40"
"How to Build Customer Success Program in 2026: A Complete Guide","CRM","crm","https://saasstatshub.com/crm/how-to-build-customer-success-program/","2026-07-11T22:10:53"
"How to Build Sales Intelligence Stack in 2026: A Complete Guide","CRM","crm","https://saasstatshub.com/crm/how-to-build-sales-intelligence-stack/","2026-07-11T22:07:45"
"How to Calculate CRM ROI","CRM","crm","https://saasstatshub.com/crm/how-to-calculate-crm-roi/","2026-07-11T21:57:28"
"How to Choose a CRM in 2026: A Complete Guide","CRM","crm","https://saasstatshub.com/crm/how-to-choose-crm/","2026-07-11T22:12:35"
"How to Implement a CRM in 2026: Step-by-Step Guide","CRM","crm","https://saasstatshub.com/crm/how-to-implement-crm/","2026-07-11T22:12:23"
"How to Implement CRM Automation in 2026: A Complete Guide","CRM","crm","https://saasstatshub.com/crm/how-to-implement-crm-automation/","2026-07-11T22:07:24"
"How to Improve Customer Retention in 2026","CRM","crm","https://saasstatshub.com/crm/how-to-improve-customer-retention/","2026-07-11T22:12:19"
"HubSpot Statistics 2026: Revenue, Customers, and Platform Benchmarks","CRM","crm","https://saasstatshub.com/crm/hubspot-statistics-2026/","2026-07-11T22:15:08"
"HubSpot vs ActiveCampaign: Which Is Better in 2026?","CRM","crm","https://saasstatshub.com/crm/hubspot-vs-activecampaign/","2026-07-11T22:45:01"
"HubSpot vs Pipedrive: Which Is Better in 2026?","CRM","crm","https://saasstatshub.com/crm/hubspot-vs-pipedrive/","2026-07-11T22:45:57"
"HubSpot vs Zoho: Which CRM Platform Offers Better Value in 2026?","CRM","crm","https://saasstatshub.com/crm/hubspot-vs-zoho/","2026-07-11T22:12:07"
"Is CRM Worth It for Small Business?","CRM","crm","https://saasstatshub.com/crm/is-crm-worth-it-for-small-business/","2026-07-11T21:56:58"
"Microsoft Dynamics 365 Statistics 2026: Revenue Growth, Product Scope, and Enterprise Adoption","CRM","crm","https://saasstatshub.com/crm/microsoft-dynamics-365-statistics-2026/","2026-07-11T22:14:15"
"Pipedrive Statistics 2026: Verified CRM Scale and Disclosure Limits","CRM","crm","https://saasstatshub.com/crm/pipedrive-statistics-2026/","2026-07-11T22:14:39"
"Pipedrive vs HubSpot: Which Is Better in 2026?","CRM","crm","https://saasstatshub.com/crm/pipedrive-vs-hubspot/","2026-07-11T22:44:47"
"Salesforce for Small Business: Complete Guide","CRM","crm","https://saasstatshub.com/crm/salesforce-for-small-business-2026/","2026-07-11T21:54:30"
"Salesforce Statistics 2026: FY26 Results and FY27 Outlook","CRM","crm","https://saasstatshub.com/crm/salesforce-statistics-2026/","2026-07-11T22:18:34"
"Salesforce vs Dynamics 365: Which Is Better in 2026?","CRM","crm","https://saasstatshub.com/crm/salesforce-vs-dynamics-365/","2026-07-11T22:45:50"
"Salesforce vs HubSpot Statistics 2026: Verified Product and Ecosystem Signals","CRM","crm","https://saasstatshub.com/crm/salesforce-vs-hubspot-statistics-2026/","2026-07-11T22:14:23"
"Salesforce vs HubSpot vs Pipedrive: Best CRM 2026","CRM","crm","https://saasstatshub.com/crm/salesforce-vs-hubspot-vs-pipedrive/","2026-07-11T22:14:09"
"Salesforce vs HubSpot: Which CRM Is Better in 2026?","CRM","crm","https://saasstatshub.com/crm/salesforce-vs-hubspot/","2026-07-11T22:11:56"
"Salesforce vs Pipedrive: Which Is Better in 2026?","CRM","crm","https://saasstatshub.com/crm/salesforce-vs-pipedrive/","2026-07-11T22:45:49"
"Salesforce vs SAP CRM: Which Is Better in 2026?","CRM","crm","https://saasstatshub.com/crm/salesforce-vs-sap-crm/","2026-07-11T22:44:41"
"Salesforce vs SugarCRM: Which Is Better in 2026?","CRM","crm","https://saasstatshub.com/crm/salesforce-vs-sugarcrm/","2026-07-11T22:44:40"
"Salesforce vs Zoho CRM: Which CRM Is Better for Your Business in 2026?","CRM","crm","https://saasstatshub.com/crm/salesforce-vs-zoho-crm/","2026-07-11T22:11:55"
"Salesforce vs Zoho: Enterprise CRM Showdown 2026","CRM","crm","https://saasstatshub.com/crm/salesforce-vs-zoho/","2026-07-11T22:13:58"
"Small Business CRM Statistics 2026: Vendor and Workflow Data","CRM","crm","https://saasstatshub.com/crm/small-business-crm-statistics-2026/","2026-07-17T22:32:57"
"The Ultimate Guide to CRM Software in 2026","CRM","crm","https://saasstatshub.com/crm/crm-ultimate-guide/","2026-07-11T21:50:42"
"What Is Account-Based Marketing?","CRM","crm","https://saasstatshub.com/crm/what-is-account-based-marketing/","2026-07-11T21:50:15"
"What Is Churn Analysis?","CRM","crm","https://saasstatshub.com/crm/what-is-churn-analysis/","2026-07-11T21:49:15"
"What Is Contact Database?","CRM","crm","https://saasstatshub.com/crm/what-is-contact-database/","2026-07-11T21:48:43"
"What Is Contact Management?","CRM","crm","https://saasstatshub.com/crm/what-is-contact-management/","2026-07-11T21:48:41"
"What Is Contact Segmentation?","CRM","crm","https://saasstatshub.com/crm/what-is-contact-segmentation/","2026-07-11T21:48:40"
"What Is CRM Analytics?","CRM","crm","https://saasstatshub.com/crm/what-is-crm-analytics/","2026-07-11T21:48:27"
"What Is CRM Integration?","CRM","crm","https://saasstatshub.com/crm/what-is-crm-integration/","2026-07-11T21:48:26"
"What Is CRM?","CRM","crm","https://saasstatshub.com/crm/what-is-crm/","2026-07-11T21:48:25"
"What Is Customer Data Platform?","CRM","crm","https://saasstatshub.com/crm/what-is-customer-data-platform/","2026-07-11T21:48:14"
"What Is Customer Lifecycle?","CRM","crm","https://saasstatshub.com/crm/what-is-customer-lifecycle/","2026-07-11T21:48:11"
"What Is Customer Onboarding?","CRM","crm","https://saasstatshub.com/crm/what-is-customer-onboarding/","2026-07-11T21:48:10"
"What Is Customer Retention?","CRM","crm","https://saasstatshub.com/crm/what-is-customer-retention/","2026-07-11T21:48:09"
"What Is Customer Success?","CRM","crm","https://saasstatshub.com/crm/what-is-customer-success/","2026-07-11T21:48:03"
"What Is Deal Management?","CRM","crm","https://saasstatshub.com/crm/what-is-deal-management/","2026-07-11T21:47:40"
"What Is Email Deliverability?","CRM","crm","https://saasstatshub.com/crm/what-is-email-deliverability/","2026-07-11T21:46:53"
"What Is Landing Page Optimization?","CRM","crm","https://saasstatshub.com/crm/what-is-landing-page-optimization/","2026-07-11T21:45:12"
"What Is Lead Nurturing?","CRM","crm","https://saasstatshub.com/crm/what-is-lead-nurturing/","2026-07-11T21:45:08"
"What Is Lead Scoring?","CRM","crm","https://saasstatshub.com/crm/what-is-lead-scoring/","2026-07-11T21:45:07"
"What Is Onboarding Automation?","CRM","crm","https://saasstatshub.com/crm/what-is-onboarding-automation/","2026-07-11T21:43:58"
"What Is Pipeline Management?","CRM","crm","https://saasstatshub.com/crm/what-is-pipeline-management/","2026-07-11T21:43:32"
"What Is Referral Marketing?","CRM","crm","https://saasstatshub.com/crm/what-is-referral-marketing/","2026-07-11T21:42:38"
"What Is Sales Automation?","CRM","crm","https://saasstatshub.com/crm/what-is-sales-automation/","2026-07-11T21:42:18"
"What Is Sales Enablement (CRM)?","CRM","crm","https://saasstatshub.com/crm/what-is-sales-enablement-crm/","2026-07-11T21:42:11"
"What Is Sales Forecasting?","CRM","crm","https://saasstatshub.com/crm/what-is-sales-forecasting/","2026-07-11T21:42:07"
"What Is Sales Pipeline?","CRM","crm","https://saasstatshub.com/crm/what-is-sales-pipeline/","2026-07-11T21:42:02"
"Zoho CRM vs HubSpot: Which CRM Is Better in 2026?","CRM","crm","https://saasstatshub.com/crm/zoho-crm-vs-hubspot/","2026-07-11T22:11:44"
"Zoho Statistics 2026: Verified Suite Scale and Disclosure Limits","CRM","crm","https://saasstatshub.com/crm/zoho-statistics-2026/","2026-07-11T22:14:30"
"Zoho vs Freshsales vs Close: 2026 CRM Comparison for Startups","CRM","crm","https://saasstatshub.com/crm/zoho-vs-freshsales-vs-close/","2026-07-12T07:47:43"
"4 Best Intercom Alternatives for 2026","Customer Support","customer-support","https://saasstatshub.com/customer-support/intercom-alternatives/","2026-07-11T21:39:55"
"AI Customer Support Tools","Customer Support","customer-support","https://saasstatshub.com/customer-support/ai-customer-support-tools/","2026-07-11T22:02:02"
"Best Customer Feedback in 2026","Customer Support","customer-support","https://saasstatshub.com/customer-support/best-customer-feedback-tools/","2026-07-11T22:05:42"
"Best Customer Support for Enterprise in 2026","Customer Support","customer-support","https://saasstatshub.com/customer-support/best-customer-support-for-enterprise/","2026-07-11T21:51:59"
"Best Customer Support for SaaS in 2026","Customer Support","customer-support","https://saasstatshub.com/customer-support/best-customer-support-for-saas/","2026-07-11T21:51:58"
"Best Customer Support in 2026","Customer Support","customer-support","https://saasstatshub.com/customer-support/best-customer-support-software/","2026-07-11T22:05:41"
"Best Free Help Desk Tools in 2026","Customer Support","customer-support","https://saasstatshub.com/customer-support/free-help-desk-tools-2026/","2026-07-11T21:58:18"
"Best Help Desk AI in 2026","Customer Support","customer-support","https://saasstatshub.com/customer-support/best-help-desk-ai-tools/","2026-07-11T22:05:19"
"Best Help Desk for Small Business in 2026","Customer Support","customer-support","https://saasstatshub.com/customer-support/best-help-desk-for-small-business/","2026-07-11T21:51:39"
"Best Knowledge Base in 2026","Customer Support","customer-support","https://saasstatshub.com/customer-support/best-knowledge-base-software/","2026-07-11T22:05:15"
"Best Live Chat in 2026","Customer Support","customer-support","https://saasstatshub.com/customer-support/best-live-chat-tools/","2026-07-11T22:05:10"
"Crisp vs Intercom: Which Is Better in 2026?","Customer Support","customer-support","https://saasstatshub.com/customer-support/crisp-vs-intercom/","2026-07-11T22:44:06"
"Customer Feedback: Collection Guide","Customer Support","customer-support","https://saasstatshub.com/customer-support/customer-feedback-collection/","2026-07-11T21:59:58"
"Customer Retention: Strategies That Work","Customer Support","customer-support","https://saasstatshub.com/customer-support/customer-retention-strategies/","2026-07-11T21:59:57"
"Customer Satisfaction Metrics","Customer Support","customer-support","https://saasstatshub.com/customer-support/customer-satisfaction-metrics/","2026-07-11T21:59:56"
"Customer Support KPIs: Essential Metrics","Customer Support","customer-support","https://saasstatshub.com/customer-support/customer-support-kpis/","2026-07-11T21:59:53"
"Freshdesk vs Help Scout: Which Is Better in 2026?","Customer Support","customer-support","https://saasstatshub.com/customer-support/freshdesk-vs-helpscout/","2026-07-11T22:43:54"
"How to Build Knowledge Base in 2026: A Complete Guide","Customer Support","customer-support","https://saasstatshub.com/customer-support/how-to-build-knowledge-base/","2026-07-11T22:03:59"
"How to Choose Live Chat Software in 2026: A Complete Guide","Customer Support","customer-support","https://saasstatshub.com/customer-support/how-to-choose-live-chat-software/","2026-07-11T22:03:49"
"How to Implement AI Customer Support in 2026: A Complete Guide","Customer Support","customer-support","https://saasstatshub.com/customer-support/how-to-implement-ai-customer-support/","2026-07-11T22:03:35"
"How to Implement Self-Service Portal in 2026: A Complete Guide","Customer Support","customer-support","https://saasstatshub.com/customer-support/how-to-implement-self-service-portal/","2026-07-11T22:03:18"
"How to Set Up Customer Support in 2026: A Complete Guide","Customer Support","customer-support","https://saasstatshub.com/customer-support/how-to-set-up-customer-support/","2026-07-11T22:03:06"
"Intercom vs Tidio: Which Is Better in 2026?","Customer Support","customer-support","https://saasstatshub.com/customer-support/intercom-vs-tidio/","2026-07-11T22:43:51"
"Live Chat Software Comparison","Customer Support","customer-support","https://saasstatshub.com/customer-support/live-chat-software-comparison/","2026-07-11T21:56:38"
"Omnichannel Support Strategy","Customer Support","customer-support","https://saasstatshub.com/customer-support/omnichannel-support-strategy/","2026-07-11T21:55:56"
"Omnichannel Support: Implementation Guide","Customer Support","customer-support","https://saasstatshub.com/customer-support/omnichannel-support-guide/","2026-07-11T21:55:57"
"Self-Service Portal: Implementation Guide","Customer Support","customer-support","https://saasstatshub.com/customer-support/self-service-portal-guide/","2026-07-11T21:54:21"
"Support Automation: Getting Started Guide","Customer Support","customer-support","https://saasstatshub.com/customer-support/support-automation-guide/","2026-07-11T21:53:56"
"Support Team Training: Complete Guide","Customer Support","customer-support","https://saasstatshub.com/customer-support/support-team-training/","2026-07-11T21:53:55"
"Support Ticket: Management Guide","Customer Support","customer-support","https://saasstatshub.com/customer-support/support-ticket-management/","2026-07-11T21:53:53"
"The Ultimate Guide to Customer Support Software in 2026","Customer Support","customer-support","https://saasstatshub.com/customer-support/customer-support-guide/","2026-07-11T21:50:41"
"Tidio vs LiveChat: Which Is Better in 2026?","Customer Support","customer-support","https://saasstatshub.com/customer-support/tidio-vs-livechat/","2026-07-11T22:43:14"
"What Is a Help Desk and How Does It Work?","Customer Support","customer-support","https://saasstatshub.com/customer-support/what-is-a-help-desk-and-how-does-it-work/","2026-07-11T21:53:22"
"What Is Call Center Software?","Customer Support","customer-support","https://saasstatshub.com/customer-support/what-is-call-center-software/","2026-07-11T21:49:30"
"What Is Community Forum?","Customer Support","customer-support","https://saasstatshub.com/customer-support/what-is-community-forum/","2026-07-11T21:49:01"
"What Is Customer Communication Platform?","Customer Support","customer-support","https://saasstatshub.com/customer-support/what-is-customer-communication-platform/","2026-07-11T21:48:16"
"What Is Customer Feedback?","Customer Support","customer-support","https://saasstatshub.com/customer-support/what-is-customer-feedback/","2026-07-11T21:48:12"
"What Is Customer Self-Service?","Customer Support","customer-support","https://saasstatshub.com/customer-support/what-is-customer-self-service/","2026-07-11T21:48:06"
"What Is Customer Success Platform?","Customer Support","customer-support","https://saasstatshub.com/customer-support/what-is-customer-success-platform/","2026-07-11T21:48:05"
"What Is Field Service Management?","Customer Support","customer-support","https://saasstatshub.com/customer-support/what-is-field-service-management/","2026-07-11T21:46:32"
"What Is Help Desk Software?","Customer Support","customer-support","https://saasstatshub.com/customer-support/what-is-help-desk-software/","2026-07-11T21:45:55"
"What Is Knowledge Base (Support)?","Customer Support","customer-support","https://saasstatshub.com/customer-support/what-is-knowledge-base-support/","2026-07-11T21:45:19"
"What Is Live Chat?","Customer Support","customer-support","https://saasstatshub.com/customer-support/what-is-live-chat/","2026-07-11T21:44:51"
"What Is Omnichannel Support?","Customer Support","customer-support","https://saasstatshub.com/customer-support/what-is-omnichannel-support/","2026-07-11T21:44:00"
"What Is SLA Management?","Customer Support","customer-support","https://saasstatshub.com/customer-support/what-is-sla-management/","2026-07-11T21:41:47"
"What Is Support Analytics?","Customer Support","customer-support","https://saasstatshub.com/customer-support/what-is-support-analytics/","2026-07-11T21:41:23"
"What Is Support Chatbot?","Customer Support","customer-support","https://saasstatshub.com/customer-support/what-is-support-chatbot/","2026-07-11T21:41:21"
"What Is Ticketing System?","Customer Support","customer-support","https://saasstatshub.com/customer-support/what-is-ticketing-system/","2026-07-11T21:41:09"
"Zendesk vs Freshdesk: Which Is Better in 2026?","Customer Support","customer-support","https://saasstatshub.com/customer-support/zendesk-vs-freshdesk-customer-support/","2026-07-11T22:43:09"
"3 Best GitHub Alternatives for 2026","DevOps & Cloud","devops","https://saasstatshub.com/devops/github-alternatives/","2026-07-11T22:42:56"
"4 Best Datadog Alternatives for 2026","DevOps & Cloud","devops","https://saasstatshub.com/devops/datadog-alternatives/","2026-07-11T22:43:01"
"API Development: Best Practices Guide","DevOps & Cloud","devops","https://saasstatshub.com/devops/api-development-guide/","2026-07-11T22:01:38"
"AWS CloudWatch vs Datadog: Which Is Better in 2026?","DevOps & Cloud","devops","https://saasstatshub.com/devops/cloudwatch-vs-datadog/","2026-07-11T22:46:06"
"AWS CloudWatch vs Grafana: Which Is Better in 2026?","DevOps & Cloud","devops","https://saasstatshub.com/devops/cloudwatch-vs-grafana/","2026-07-11T22:45:14"
"AWS vs Azure vs GCP: Which Is Better in 2026?","DevOps & Cloud","devops","https://saasstatshub.com/devops/aws-vs-azure-vs-gcp/","2026-07-11T22:45:28"
"Best API Gateway in 2026","DevOps & Cloud","devops","https://saasstatshub.com/devops/best-api-gateways/","2026-07-11T22:09:30"
"Best API Management Tools in 2026","DevOps & Cloud","devops","https://saasstatshub.com/devops/best-api-management-tools/","2026-07-11T22:11:28"
"Best API Management Tools in 2027: New Platforms","DevOps & Cloud","devops","https://saasstatshub.com/devops/best-api-management-tools-2027/","2026-07-11T21:52:32"
"Best CI CD Tools in 2026","DevOps & Cloud","devops","https://saasstatshub.com/devops/best-ci-cd-tools/","2026-07-11T22:11:27"
"Best CI/CD Tools in 2026","DevOps & Cloud","devops","https://saasstatshub.com/devops/best-ci-cd-tools-2027/","2026-07-11T21:52:27"
"Best Cloud Hosting Providers in 2026","DevOps & Cloud","devops","https://saasstatshub.com/devops/best-cloud-hosting-providers/","2026-07-11T22:11:26"
"Best Cloud Platform for Startups in 2026","DevOps & Cloud","devops","https://saasstatshub.com/devops/best-cloud-platform-for-startups/","2026-07-11T21:52:26"
"Best Cloud Platforms 2026","DevOps & Cloud","devops","https://saasstatshub.com/devops/best-cloud-platforms-2026/","2026-07-11T22:01:31"
"Best Container Orchestration Tools in 2026","DevOps & Cloud","devops","https://saasstatshub.com/devops/best-container-orchestration-tools/","2026-07-11T21:52:22"
"Best Container Platforms in 2026","DevOps & Cloud","devops","https://saasstatshub.com/devops/best-container-platforms/","2026-07-11T22:11:24"
"Best Database Management in 2026","DevOps & Cloud","devops","https://saasstatshub.com/devops/best-database-management-tools/","2026-07-11T22:09:08"
"Best Developer Tools in 2026","DevOps & Cloud","devops","https://saasstatshub.com/devops/best-developer-tools/","2026-07-11T22:11:20"
"Best DevOps Tools in 2026","DevOps & Cloud","devops","https://saasstatshub.com/devops/best-devops-tools/","2026-07-11T22:11:18"
"Best Edge Computing Platforms in 2026","DevOps & Cloud","devops","https://saasstatshub.com/devops/best-edge-computing-platforms/","2026-07-11T22:11:17"
"Best Feature Flags in 2026","DevOps & Cloud","devops","https://saasstatshub.com/devops/best-feature-flag-tools/","2026-07-11T22:09:00"
"Best Free Cloud Hosting in 2026","DevOps & Cloud","devops","https://saasstatshub.com/devops/free-cloud-hosting-2026/","2026-07-11T21:58:26"
"Best Infrastructure Monitoring in 2026","DevOps & Cloud","devops","https://saasstatshub.com/devops/best-infrastructure-monitoring-tools/","2026-07-11T22:08:54"
"Best Monitoring Tools for DevOps in 2026","DevOps & Cloud","devops","https://saasstatshub.com/devops/best-monitoring-tools-for-devops/","2026-07-11T21:51:18"
"Best Monitoring Tools in 2026","DevOps & Cloud","devops","https://saasstatshub.com/devops/best-monitoring-tools/","2026-07-11T22:11:13"
"Best Serverless Platforms in 2026","DevOps & Cloud","devops","https://saasstatshub.com/devops/best-serverless-platforms/","2026-07-11T22:11:08"
"Capacity Planning: Spreadsheet Template","DevOps & Cloud","devops","https://saasstatshub.com/devops/capacity-planning-template/","2026-07-11T22:01:05"
"CI/CD Pipeline Explained","DevOps & Cloud","devops","https://saasstatshub.com/devops/ci-cd-pipeline-explained/","2026-07-11T22:01:00"
"CI/CD Pipeline: Configuration Template","DevOps & Cloud","devops","https://saasstatshub.com/devops/cicd-pipeline-template/","2026-07-11T22:00:58"
"CI/CD Pipeline: Setup Guide","DevOps & Cloud","devops","https://saasstatshub.com/devops/ci-cd-pipeline-setup-guide/","2026-07-11T22:00:59"
