"title","category","category_slug","url","last_modified"
"What Is PIM?","E-commerce","ecommerce","https://saasstatshub.com/ecommerce/what-is-pim/","2026-07-11T21:43:33"
"What Is Product Discovery?","E-commerce","ecommerce","https://saasstatshub.com/ecommerce/what-is-product-discovery/","2026-07-11T21:43:20"
"What Is Product Information Management?","E-commerce","ecommerce","https://saasstatshub.com/ecommerce/what-is-product-information-management/","2026-07-11T21:43:18"
"What Is Product Page Optimization?","E-commerce","ecommerce","https://saasstatshub.com/ecommerce/what-is-product-page-optimization/","2026-07-11T21:43:17"
"What Is Shopify?","E-commerce","ecommerce","https://saasstatshub.com/ecommerce/what-is-shopify/","2026-07-11T21:41:50"
"What Is Shopping Cart?","E-commerce","ecommerce","https://saasstatshub.com/ecommerce/what-is-shopping-cart/","2026-07-11T21:41:48"
"What Is Subscription Box?","E-commerce","ecommerce","https://saasstatshub.com/ecommerce/what-is-subscription-box/","2026-07-11T21:41:30"
"What Is Subscription Commerce?","E-commerce","ecommerce","https://saasstatshub.com/ecommerce/what-is-subscription-commerce/","2026-07-11T21:41:28"
"What Is WooCommerce?","E-commerce","ecommerce","https://saasstatshub.com/ecommerce/what-is-woocommerce/","2026-07-11T21:40:34"
"WooCommerce Statistics 2026: Verified Plugin Scale and Disclosure Limits","E-commerce","ecommerce","https://saasstatshub.com/ecommerce/woocommerce-statistics-2026/","2026-07-11T22:14:32"
"WooCommerce vs BigCommerce: Which Is Better in 2026?","E-commerce","ecommerce","https://saasstatshub.com/ecommerce/woocommerce-vs-bigcommerce/","2026-07-11T22:44:26"
"WooCommerce vs Magento: Which E-commerce Platform Is Better in 2026?","E-commerce","ecommerce","https://saasstatshub.com/ecommerce/woocommerce-vs-magento/","2026-07-11T22:11:48"
"WooCommerce vs Shopify vs Magento: Which Is Better in 2026?","E-commerce","ecommerce","https://saasstatshub.com/ecommerce/woocommerce-vs-shopify-vs-magento/","2026-07-11T22:44:25"
"WooCommerce vs Shopify: Which Is Better in 2026?","E-commerce","ecommerce","https://saasstatshub.com/ecommerce/woocommerce-vs-shopify/","2026-07-11T22:45:38"
"WordPress vs Webflow: Which Website Builder Is Better in 2026?","E-commerce","ecommerce","https://saasstatshub.com/ecommerce/wordpress-vs-webflow/","2026-07-11T22:11:46"
"Adobe Sign vs DocuSign: Which Is Better in 2026?","E-Signature","e-signature","https://saasstatshub.com/e-signature/adobe-sign-vs-docusign-business/","2026-07-11T22:44:20"
"Best Digital Signature in 2026","E-Signature","e-signature","https://saasstatshub.com/e-signature/best-digital-signature-tools/","2026-07-11T22:05:39"
"Best E-Signature for Enterprise in 2026","E-Signature","e-signature","https://saasstatshub.com/e-signature/best-e-signature-for-enterprise/","2026-07-11T22:05:35"
"Best E-Signature for Small Business in 2026","E-Signature","e-signature","https://saasstatshub.com/e-signature/best-e-signature-for-small-business/","2026-07-11T22:05:34"
"Best E-Signature in 2026","E-Signature","e-signature","https://saasstatshub.com/e-signature/best-e-signature-software/","2026-07-11T22:05:33"
"Best E-Signature Tools 2026","E-Signature","e-signature","https://saasstatshub.com/e-signature/best-e-signature-tools-2026/","2026-07-11T22:01:26"
"Best Free E-Signature in 2026","E-Signature","e-signature","https://saasstatshub.com/e-signature/best-free-e-signature-tools/","2026-07-11T22:05:23"
"Best Free E-Signature Tools in 2026","E-Signature","e-signature","https://saasstatshub.com/e-signature/free-e-signature-tools-2026/","2026-07-11T21:58:22"
"Bulk E-Signature: Solutions Compared","E-Signature","e-signature","https://saasstatshub.com/e-signature/bulk-e-signature-solutions/","2026-07-11T22:01:07"
"Digital Signature vs E-Signature","E-Signature","e-signature","https://saasstatshub.com/e-signature/digital-signature-vs-e-signature/","2026-07-11T21:59:36"
"DocuSign vs PandaDoc: Which Is Better in 2026?","E-Signature","e-signature","https://saasstatshub.com/e-signature/docusign-vs-pandadoc/","2026-07-11T22:44:02"
"DocuSign vs Ropesoft: Which Is Better in 2026?","E-Signature","e-signature","https://saasstatshub.com/e-signature/docusign-vs-ropesoft/","2026-07-11T22:44:01"
"E-Signature API: Integration Guide","E-Signature","e-signature","https://saasstatshub.com/e-signature/e-signature-api-guide/","2026-07-11T21:59:29"
"E-Signature Compliance Guide","E-Signature","e-signature","https://saasstatshub.com/e-signature/e-signature-compliance-guide/","2026-07-11T21:59:27"
"E-Signature Compliance: What You Need to Know","E-Signature","e-signature","https://saasstatshub.com/e-signature/e-signature-compliance/","2026-07-11T21:59:26"
"E-Signature for HR: Use Cases and Benefits","E-Signature","e-signature","https://saasstatshub.com/e-signature/e-signature-for-hr/","2026-07-11T21:59:25"
"E-Signature for Real Estate","E-Signature","e-signature","https://saasstatshub.com/e-signature/e-signature-for-real-estate/","2026-07-11T21:59:23"
"E-Signature Integrations: Connecting Systems","E-Signature","e-signature","https://saasstatshub.com/e-signature/e-signature-integrations/","2026-07-11T21:59:22"
"E-Signature Legal Validity: Complete Guide","E-Signature","e-signature","https://saasstatshub.com/e-signature/e-signature-legal-validity/","2026-07-11T21:59:18"
"E-Signature Security: Best Practices","E-Signature","e-signature","https://saasstatshub.com/e-signature/e-signature-security-guide/","2026-07-11T21:59:17"
"E-Signature vs Wet Signature: Comparison","E-Signature","e-signature","https://saasstatshub.com/e-signature/e-signature-vs-wet-signature/","2026-07-11T21:59:16"
"HelloSign vs SignNow: Which Is Better in 2026?","E-Signature","e-signature","https://saasstatshub.com/e-signature/hellosign-vs-signnow/","2026-07-11T22:43:52"
"How to Automate Document Signing in 2026: A Complete Guide","E-Signature","e-signature","https://saasstatshub.com/e-signature/how-to-automate-document-signing/","2026-07-11T22:04:05"
"How to Choose E-Signature Tool in 2026: A Complete Guide","E-Signature","e-signature","https://saasstatshub.com/e-signature/how-to-choose-e-signature-tool/","2026-07-11T22:03:52"
"How to Ensure E-Signature Compliance in 2026: A Complete Guide","E-Signature","e-signature","https://saasstatshub.com/e-signature/how-to-ensure-e-signature-compliance/","2026-07-11T22:03:37"
"How to Implement E-Signature in 2026: A Complete Guide","E-Signature","e-signature","https://saasstatshub.com/e-signature/how-to-implement-e-signature/","2026-07-11T22:03:29"
"How to Integrate E-Signature with CRM in 2026: A Complete Guide","E-Signature","e-signature","https://saasstatshub.com/e-signature/how-to-integrate-esignature-crm/","2026-07-11T22:03:14"
"SignNow vs PandaDoc: Which Is Better in 2026?","E-Signature","e-signature","https://saasstatshub.com/e-signature/signnow-vs-pandadoc/","2026-07-11T22:43:20"
"The Ultimate Guide to E-Signature Software in 2026","E-Signature","e-signature","https://saasstatshub.com/e-signature/e-signature-guide/","2026-07-11T21:50:36"
"What Is an E-Signature and Is It Legally Binding?","E-Signature","e-signature","https://saasstatshub.com/e-signature/what-is-an-e-signature-and-is-it-legally-binding/","2026-07-11T21:53:19"
"What Is CLM?","E-Signature","e-signature","https://saasstatshub.com/e-signature/what-is-clm/","2026-07-11T21:49:11"
"What Is Digital Signature?","E-Signature","e-signature","https://saasstatshub.com/e-signature/what-is-digital-signature/","2026-07-11T21:47:33"
"What Is Document Generation?","E-Signature","e-signature","https://saasstatshub.com/e-signature/what-is-document-generation/","2026-07-11T21:47:27"
"What Is Document Workflow?","E-Signature","e-signature","https://saasstatshub.com/e-signature/what-is-document-workflow/","2026-07-11T21:47:26"
"What Is E-Sign Compliance?","E-Signature","e-signature","https://saasstatshub.com/e-signature/what-is-e-sign-compliance/","2026-07-11T21:47:07"
"What Is E-Signature Software?","E-Signature","e-signature","https://saasstatshub.com/e-signature/what-is-e-signature-software/","2026-07-11T21:47:06"
"What Is Electronic Notarization?","E-Signature","e-signature","https://saasstatshub.com/e-signature/what-is-electronic-notarization/","2026-07-11T21:46:54"
"What Is Form Builder?","E-Signature","e-signature","https://saasstatshub.com/e-signature/what-is-form-builder/","2026-07-11T21:46:19"
"What Is Identity Verification?","E-Signature","e-signature","https://saasstatshub.com/e-signature/what-is-identity-verification/","2026-07-11T21:45:39"
"What Is Seal Management?","E-Signature","e-signature","https://saasstatshub.com/e-signature/what-is-seal-management/","2026-07-11T21:41:57"
"Adaptive Learning Technology Explained","Education","education","https://saasstatshub.com/education/adaptive-learning-technology-explained/","2026-07-11T22:02:11"
"Assessment Tools: Best for Teachers","Education","education","https://saasstatshub.com/education/assessment-tools-for-teachers/","2026-07-11T22:01:36"
"Best Corporate Training in 2026","Education","education","https://saasstatshub.com/education/best-corporate-training-platforms/","2026-07-11T22:05:44"
"Best eLearning Software in 2026","Education","education","https://saasstatshub.com/education/best-elearning-software/","2026-07-11T22:05:29"
"Best Free LMS Options in 2026","Education","education","https://saasstatshub.com/education/free-lms-options-2026/","2026-07-11T21:58:11"
"Best LMS Platforms in 2026","Education","education","https://saasstatshub.com/education/best-lms-platforms/","2026-07-11T22:05:08"
"Best Online Course Platforms in 2026","Education","education","https://saasstatshub.com/education/best-online-course-platforms/","2026-07-11T22:04:57"
"Best Quiz and Assessment in 2026","Education","education","https://saasstatshub.com/education/best-quiz-assessment-tools/","2026-07-11T22:04:54"
"Best Student Information Systems in 2026","Education","education","https://saasstatshub.com/education/best-student-information-systems/","2026-07-11T22:04:45"
"Best Virtual Classroom in 2026","Education","education","https://saasstatshub.com/education/best-virtual-classroom-software/","2026-07-11T22:04:39"
"Blackboard vs Canvas: Which Is Better in 2026?","Education","education","https://saasstatshub.com/education/blackboard-vs-canvas/","2026-07-11T22:44:16"
"Blended Learning: Implementation Guide","Education","education","https://saasstatshub.com/education/blended-learning-guide/","2026-07-11T22:01:14"
"Canvas vs Moodle: Which Is Better in 2026?","Education","education","https://saasstatshub.com/education/canvas-vs-moodle/","2026-07-11T22:44:14"
"Corporate Training: Measuring ROI","Education","education","https://saasstatshub.com/education/corporate-training-roi/","2026-07-11T22:00:21"
"E-Learning Content: Development Guide","Education","education","https://saasstatshub.com/education/elearning-content-development/","2026-07-11T21:58:59"
"EdTech Trends: What to Watch","Education","education","https://saasstatshub.com/education/educational-technology-trends/","2026-07-11T21:59:00"
"How to Build Online Course in 2026: A Complete Guide","Education","education","https://saasstatshub.com/education/how-to-build-online-course/","2026-07-11T22:03:58"
"How to Choose LMS in 2026: A Complete Guide","Education","education","https://saasstatshub.com/education/how-to-choose-lms-platform/","2026-07-11T22:03:47"
"How to Create Interactive Quizzes in 2026: A Complete Guide","Education","education","https://saasstatshub.com/education/how-to-create-interactive-quizzes/","2026-07-11T22:03:41"
"How to Design Microlearning in 2026: A Complete Guide","Education","education","https://saasstatshub.com/education/how-to-design-microlearning/","2026-07-11T22:03:39"
"How to Implement Corporate Training in 2026: A Complete Guide","Education","education","https://saasstatshub.com/education/how-to-implement-corporate-training/","2026-07-11T22:03:31"
"How to Set Up Student Information System in 2026: A Complete Guide","Education","education","https://saasstatshub.com/education/how-to-set-up-student-information-system/","2026-07-11T22:02:59"
"Kajabi vs Teachable: Which Is Better in 2026?","Education","education","https://saasstatshub.com/education/kajabi-vs-teachable/","2026-07-11T22:43:48"
"Learning Design: Best Practices Guide","Education","education","https://saasstatshub.com/education/learning-design-guide/","2026-07-11T21:56:44"
"LearnWorlds vs Thinkific: Which Is Better in 2026?","Education","education","https://saasstatshub.com/education/learnworlds-vs-thinkific/","2026-07-11T22:43:44"
"LMS for Corporate Training","Education","education","https://saasstatshub.com/education/lms-for-corporate-training/","2026-07-11T21:56:37"
"Online Course Creation: Complete Guide","Education","education","https://saasstatshub.com/education/online-course-creation-guide/","2026-07-11T21:55:53"
"Online Learning Platforms Comparison","Education","education","https://saasstatshub.com/education/online-learning-platforms-comparison/","2026-07-11T21:55:52"
"Student Engagement Tools Guide","Education","education","https://saasstatshub.com/education/student-engagement-tools-guide/","2026-07-11T21:54:06"
"Student Engagement: Essential Tools","Education","education","https://saasstatshub.com/education/student-engagement-tools/","2026-07-11T21:54:05"
"TalentLMS vs iSpring: Which Is Better in 2026?","Education","education","https://saasstatshub.com/education/talentlms-vs-ispring/","2026-07-11T22:43:17"
"The Ultimate Guide to Education Technology in 2026","Education","education","https://saasstatshub.com/education/education-technology-guide/","2026-07-11T21:50:34"
"Thinkific vs Teachable: Which Is Better in 2026?","Education","education","https://saasstatshub.com/education/thinkific-vs-teachable/","2026-07-11T22:43:15"
"Udemy vs Coursera: Which Is Better in 2026?","Education","education","https://saasstatshub.com/education/udemy-vs-coursera/","2026-07-11T22:43:12"
"Virtual Classroom: Setup Guide","Education","education","https://saasstatshub.com/education/virtual-classroom-setup/","2026-07-11T21:53:37"
"What Is a Learning Management System (LMS)?","Education","education","https://saasstatshub.com/education/what-is-a-learning-management-system-lms/","2026-07-11T21:53:21"
"What Is Academic Research Tools?","Education","education","https://saasstatshub.com/education/what-is-academic-research-tools/","2026-07-11T21:50:16"
"What Is Adaptive Learning?","Education","education","https://saasstatshub.com/education/what-is-adaptive-learning/","2026-07-11T21:50:07"
"What Is Assessment Software?","Education","education","https://saasstatshub.com/education/what-is-assessment-software/","2026-07-11T21:49:46"
"What Is Campus Management?","Education","education","https://saasstatshub.com/education/what-is-campus-management/","2026-07-11T21:49:30"
"What Is Curriculum Management?","Education","education","https://saasstatshub.com/education/what-is-curriculum-management/","2026-07-11T21:48:20"
"What Is EdTech?","Education","education","https://saasstatshub.com/education/what-is-edtech/","2026-07-11T21:47:00"
"What Is Education Analytics?","Education","education","https://saasstatshub.com/education/what-is-education-analytics/","2026-07-11T21:46:59"
"What Is Education Content?","Education","education","https://saasstatshub.com/education/what-is-education-content/","2026-07-11T21:46:58"
"What Is Education LMS?","Education","education","https://saasstatshub.com/education/what-is-education-lms/","2026-07-11T21:46:57"
"What Is Enrollment Management?","Education","education","https://saasstatshub.com/education/what-is-enrollment-management/","2026-07-11T21:46:39"
"What Is Higher Ed CRM?","Education","education","https://saasstatshub.com/education/what-is-higher-ed-crm/","2026-07-11T21:45:53"
"What Is K-12 Administration?","Education","education","https://saasstatshub.com/education/what-is-k-12-administration/","2026-07-11T21:45:21"
"What Is Online Course Platform?","Education","education","https://saasstatshub.com/education/what-is-online-course-platform/","2026-07-11T21:43:57"
"What Is Parent Communication?","Education","education","https://saasstatshub.com/education/what-is-parent-communication/","2026-07-11T21:43:52"
"What Is Plagiarism Detection?","Education","education","https://saasstatshub.com/education/what-is-plagiarism-detection/","2026-07-11T21:43:30"
"What Is Special Education Software?","Education","education","https://saasstatshub.com/education/what-is-special-education-software/","2026-07-11T21:41:39"
"What Is Student Engagement?","Education","education","https://saasstatshub.com/education/what-is-student-engagement/","2026-07-11T21:41:34"
"What Is Student Information System?","Education","education","https://saasstatshub.com/education/what-is-student-information-system/","2026-07-11T21:41:33"
"What Is Teacher PD?","Education","education","https://saasstatshub.com/education/what-is-teacher-pd/","2026-07-11T21:41:15"
"What Is Virtual Classroom?","Education","education","https://saasstatshub.com/education/what-is-virtual-classroom/","2026-07-11T21:40:54"
"3 Best FreshBooks Alternatives for 2026","Finance","finance","https://saasstatshub.com/finance/freshbooks-alternatives/","2026-07-11T22:42:58"
"4 Best QuickBooks Alternatives for 2026","Finance","finance","https://saasstatshub.com/finance/quickbooks-alternatives/","2026-07-11T22:42:41"
"Accounts Receivable: Automation Guide","Finance","finance","https://saasstatshub.com/finance/accounts-receivable-automation/","2026-07-11T22:02:13"
"Accounts Receivable: Tracking Template","Finance","finance","https://saasstatshub.com/finance/accounts-receivable-template/","2026-07-11T22:02:12"
"Audit Preparation: Checklist Template","Finance","finance","https://saasstatshub.com/finance/audit-preparation-checklist/","2026-07-11T22:01:35"
"Best Accounting Software 2026","Finance","finance","https://saasstatshub.com/finance/best-accounting-software-2026/","2026-07-11T22:01:32"
"Best Accounting Software for Enterprise in 2026","Finance","finance","https://saasstatshub.com/finance/best-accounting-software-for-enterprise/","2026-07-11T21:52:51"
"Best Accounting Software for Nonprofits in 2026","Finance","finance","https://saasstatshub.com/finance/best-accounting-software-for-nonprofits/","2026-07-11T21:52:50"
"Best Accounting Software for Small Business in 2026","Finance","finance","https://saasstatshub.com/finance/best-accounting-software-for-small-business/","2026-07-11T21:52:49"
"Best Accounting Software in 2026","Finance","finance","https://saasstatshub.com/finance/best-accounting-software/","2026-07-11T22:13:26"
"Best Accounts Payable Software in 2026","Finance","finance","https://saasstatshub.com/finance/best-accounts-payable-software/","2026-07-11T22:11:39"
"Best Automated Billing in 2026","Finance","finance","https://saasstatshub.com/finance/best-automated-billing-software/","2026-07-11T22:09:29"
"Best Billing Software for SaaS in 2026","Finance","finance","https://saasstatshub.com/finance/best-billing-software-for-saas/","2026-07-11T21:52:29"
"Best Budgeting Tools for Business in 2026","Finance","finance","https://saasstatshub.com/finance/best-budgeting-tools-for-business/","2026-07-11T21:52:28"
"Best Expense Management Software in 2026","Finance","finance","https://saasstatshub.com/finance/best-expense-management-software/","2026-07-11T22:11:16"
"Best Expense Management Tools in 2026","Finance","finance","https://saasstatshub.com/finance/best-expense-management-tools/","2026-07-11T21:51:43"
"Best Financial Consolidation in 2026","Finance","finance","https://saasstatshub.com/finance/best-financial-consolidation-software/","2026-07-11T22:08:59"
"Best Financial Planning Software in 2026","Finance","finance","https://saasstatshub.com/finance/best-financial-planning-software/","2026-07-11T22:11:15"
"Best Financial Reporting Tools in 2026","Finance","finance","https://saasstatshub.com/finance/best-financial-reporting-tools/","2026-07-11T21:51:41"
"Best Forex Trading in 2026","Finance","finance","https://saasstatshub.com/finance/best-forex-trading-platform/","2026-07-11T22:08:58"
"Best Free Accounting Software 2026","Finance","finance","https://saasstatshub.com/finance/free-accounting-software-2026/","2026-07-11T21:58:32"
"Best Invoicing Software for Freelancers in 2026","Finance","finance","https://saasstatshub.com/finance/best-invoicing-software-for-freelancers/","2026-07-11T21:51:30"
"Best Invoicing Software in 2026","Finance","finance","https://saasstatshub.com/finance/best-invoicing-software/","2026-07-11T22:11:14"
"Best Payment Gateway in 2026","Finance","finance","https://saasstatshub.com/finance/best-payment-gateway/","2026-07-11T22:11:09"
"Best Payment Processing for Small Business in 2026","Finance","finance","https://saasstatshub.com/finance/best-payment-processing-for-small-business/","2026-07-11T21:51:15"
"Best Recurring Billing in 2026","Finance","finance","https://saasstatshub.com/finance/best-recurring-billing-software/","2026-07-11T22:08:40"
"Best Subscription Billing Software in 2026","Finance","finance","https://saasstatshub.com/finance/best-subscription-billing-software/","2026-07-11T22:11:07"
"Best Tax Software for Small Business in 2026","Finance","finance","https://saasstatshub.com/finance/best-tax-software-for-small-business/","2026-07-11T21:50:47"
"Budget Forecast: Spreadsheet Template","Finance","finance","https://saasstatshub.com/finance/budget-forecast-template/","2026-07-11T22:01:10"
"Budgeting Tools: Top Picks for 2026","Finance","finance","https://saasstatshub.com/finance/budgeting-tools-2026/","2026-07-11T22:01:09"
"Cash Flow: Projection Template","Finance","finance","https://saasstatshub.com/finance/cash-flow-template/","2026-07-11T22:01:03"
"Chargebee vs Recurly: Which Is Better in 2026?","Finance","finance","https://saasstatshub.com/finance/chargebee-vs-recurly/","2026-07-11T22:45:21"
"Expense Report: Template","Finance","finance","https://saasstatshub.com/finance/expense-report-template/","2026-07-11T21:58:43"
"Expense Tracking: Essential Tools","Finance","finance","https://saasstatshub.com/finance/expense-tracking-tools/","2026-07-11T21:58:42"
"Financial Dashboards: Design and Implementation","Finance","finance","https://saasstatshub.com/finance/financial-dashboards-guide/","2026-07-11T21:58:41"
"Financial Forecasting: Complete Guide","Finance","finance","https://saasstatshub.com/finance/financial-forecasting-guide/","2026-07-11T21:58:40"
"Financial Projection: 3-Year Template","Finance","finance","https://saasstatshub.com/finance/financial-projection-template/","2026-07-11T21:58:38"
"Financial Report: Monthly Template","Finance","finance","https://saasstatshub.com/finance/financial-report-template/","2026-07-11T21:58:37"
"Financial Reporting Best Practices","Finance","finance","https://saasstatshub.com/finance/financial-reporting-best-practices/","2026-07-11T21:58:36"
"Financial Reporting: Complete Guide","Finance","finance","https://saasstatshub.com/finance/financial-reporting-guide/","2026-07-11T21:58:35"
"FinTech Trends 2027","Finance","finance","https://saasstatshub.com/finance/fintech-trends-2027/","2026-07-11T21:58:33"
"FreshBooks vs QuickBooks Online: Which Is Better in 2026?","Finance","finance","https://saasstatshub.com/finance/freshbooks-vs-quickbooks-online/","2026-07-11T22:46:04"
"How to Automate Invoicing in 2026: A Complete Guide","Finance","finance","https://saasstatshub.com/finance/how-to-automate-invoicing/","2026-07-11T22:46:00"
"How to Automate Recurring Billing in 2026: A Complete Guide","Finance","finance","https://saasstatshub.com/finance/how-to-automate-recurring-billing/","2026-07-11T22:07:57"
"How to Choose Accounting Software in 2026","Finance","finance","https://saasstatshub.com/finance/how-to-choose-accounting-software/","2026-07-11T22:12:38"
"How to Choose Billing Software in 2026: A Complete Guide","Finance","finance","https://saasstatshub.com/finance/how-to-choose-billing-software/","2026-07-11T22:07:41"
"How to Choose Expense Management in 2026: A Complete Guide","Finance","finance","https://saasstatshub.com/finance/how-to-choose-expense-management/","2026-07-11T22:10:46"
"How to Choose Financial Planning Tool in 2026: A Complete Guide","Finance","finance","https://saasstatshub.com/finance/how-to-choose-financial-planning-tool/","2026-07-11T22:10:45"
"How to Choose Payment Gateway in 2026: A Complete Guide","Finance","finance","https://saasstatshub.com/finance/how-to-choose-payment-gateway/","2026-07-11T22:10:43"
"How to Choose Subscription Billing in 2026: A Complete Guide","Finance","finance","https://saasstatshub.com/finance/how-to-choose-subscription-billing/","2026-07-11T22:10:42"
"How to Implement Recurring Billing in 2026: A Complete Guide","Finance","finance","https://saasstatshub.com/finance/how-to-implement-recurring-billing/","2026-07-11T22:07:10"
"How to Manage SaaS Expenses in 2026: A Complete Guide","Finance","finance","https://saasstatshub.com/finance/how-to-manage-expenses-saas/","2026-07-11T22:10:29"
"Invoice Automation Benefits","Finance","finance","https://saasstatshub.com/finance/invoice-automation-benefits/","2026-07-11T21:57:02"
"Invoice Template: Free Download and Guide","Finance","finance","https://saasstatshub.com/finance/invoice-template-download/","2026-07-11T21:57:01"
"Invoice: Professional Template","Finance","finance","https://saasstatshub.com/finance/invoice-template/","2026-07-11T21:56:59"
"Payment Processing: Solutions Compared","Finance","finance","https://saasstatshub.com/finance/payment-processing-comparison/","2026-07-11T21:55:47"
"Payroll Calculator: Spreadsheet Template","Finance","finance","https://saasstatshub.com/finance/payroll-calculator-template/","2026-07-11T21:55:45"
"QuickBooks vs FreshBooks: Which Accounting Software Is Better in 2026?","Finance","finance","https://saasstatshub.com/finance/quickbooks-vs-freshbooks/","2026-07-11T22:11:59"
