"title","category","category_slug","url","last_modified"
"AI Adoption Trends 2027","AI","ai","https://saasstatshub.com/ai/ai-adoption-trends-2027/","2026-07-11T22:02:09"
"AI Chatbot for Website: Implementation Guide","AI","ai","https://saasstatshub.com/ai/ai-chatbot-for-website/","2026-07-11T22:02:07"
"AI Cost-Benefit Analysis for Business","AI","ai","https://saasstatshub.com/ai/ai-cost-benefit-analysis-for-business/","2026-07-11T22:02:06"
"AI Cost-Benefit Analysis: How to Calculate","AI","ai","https://saasstatshub.com/ai/ai-cost-benefit-analysis/","2026-07-11T22:02:05"
"AI Customer Service Implementation","AI","ai","https://saasstatshub.com/ai/ai-customer-service-implementation/","2026-07-11T22:02:03"
"AI Data: Requirements Template","AI","ai","https://saasstatshub.com/ai/ai-data-requirements/","2026-07-11T22:02:01"
"AI Ethics Framework: Implementation","AI","ai","https://saasstatshub.com/ai/ai-ethics-framework/","2026-07-11T22:01:59"
"AI Ethics: Checklist Template","AI","ai","https://saasstatshub.com/ai/ai-ethics-checklist/","2026-07-11T22:02:00"
"AI Ethics: What You Need to Know","AI","ai","https://saasstatshub.com/ai/ai-ethics-guide/","2026-07-11T22:01:58"
"AI for Customer Service: Getting Started","AI","ai","https://saasstatshub.com/ai/ai-for-customer-service/","2026-07-11T22:01:56"
"AI for Marketing: Practical Guide","AI","ai","https://saasstatshub.com/ai/ai-for-marketing-guide/","2026-07-11T22:01:55"
"AI Governance: Policy Template","AI","ai","https://saasstatshub.com/ai/ai-governance-policy/","2026-07-11T22:01:53"
"AI Implementation: Checklist Template","AI","ai","https://saasstatshub.com/ai/ai-implementation-checklist/","2026-07-11T22:01:52"
"AI Implementation: Getting Started Guide","AI","ai","https://saasstatshub.com/ai/ai-implementation-guide/","2026-07-11T22:01:51"
"AI Readiness: Assessment Template","AI","ai","https://saasstatshub.com/ai/ai-readiness-assessment/","2026-07-11T22:01:50"
"AI ROI: Calculator Template","AI","ai","https://saasstatshub.com/ai/ai-roi-calculator/","2026-07-11T22:01:48"
"AI Success: Metrics Template","AI","ai","https://saasstatshub.com/ai/ai-success-metrics/","2026-07-11T22:01:47"
"AI Training: Plan Template","AI","ai","https://saasstatshub.com/ai/ai-training-plan/","2026-07-11T22:01:45"
"AI Use Case: Documentation Template","AI","ai","https://saasstatshub.com/ai/ai-use-case-template/","2026-07-11T22:01:44"
"AI Vendor: Evaluation Template","AI","ai","https://saasstatshub.com/ai/ai-vendor-evaluation/","2026-07-11T22:01:43"
"AI vs Automation: Understanding the Difference","AI","ai","https://saasstatshub.com/ai/ai-vs-automation-difference/","2026-07-11T22:01:42"
"AI Writing Tools Comparison","AI","ai","https://saasstatshub.com/ai/ai-writing-tools-comparison/","2026-07-11T22:01:41"
"Best AI Analytics Tools in 2026","AI","ai","https://saasstatshub.com/ai/best-ai-data-analytics-tools/","2026-07-11T22:11:35"
"Best AI Assistants in 2026","AI","ai","https://saasstatshub.com/ai/best-ai-assistants/","2026-07-11T22:11:39"
"Best AI Chatbot for Website in 2026","AI","ai","https://saasstatshub.com/ai/best-ai-chatbot-for-website/","2026-07-11T21:52:46"
"Best AI Chatbot Platforms in 2026","AI","ai","https://saasstatshub.com/ai/best-ai-chatbot-platforms/","2026-07-11T22:11:38"
"Best AI Code Assistants in 2026","AI","ai","https://saasstatshub.com/ai/best-ai-code-assistants/","2026-07-11T22:09:40"
"Best AI Content Tools in 2026","AI","ai","https://saasstatshub.com/ai/best-ai-content-tools/","2026-07-11T22:11:37"
"Best AI Customer Service Tools in 2026","AI","ai","https://saasstatshub.com/ai/best-ai-customer-service-tools/","2026-07-11T22:11:36"
"Best AI Data Analytics in 2026","AI","ai","https://saasstatshub.com/ai/best-ai-data-analytics-platforms/","2026-07-11T22:09:39"
"Best AI Image Generators in 2026","AI","ai","https://saasstatshub.com/ai/best-ai-image-generation-tools/","2026-07-11T22:11:34"
"Best AI Meeting Assistants in 2026","AI","ai","https://saasstatshub.com/ai/best-ai-meeting-assistants/","2026-07-11T22:09:37"
"Best AI Note Taking in 2026","AI","ai","https://saasstatshub.com/ai/best-ai-note-taking-tools/","2026-07-11T22:09:36"
"Best AI Presentation Makers in 2026","AI","ai","https://saasstatshub.com/ai/best-ai-presentation-makers/","2026-07-11T22:09:35"
"Best AI Recruiting Tools in 2026","AI","ai","https://saasstatshub.com/ai/best-ai-recruiting-tools/","2026-07-11T22:11:32"
"Best AI Sales Tools in 2026","AI","ai","https://saasstatshub.com/ai/best-ai-sales-tools/","2026-07-11T22:11:31"
"Best AI SEO in 2026","AI","ai","https://saasstatshub.com/ai/best-ai-seo-tools/","2026-07-11T22:09:32"
"Best AI Tools for Business in 2026","AI","ai","https://saasstatshub.com/ai/best-ai-tools-for-business/","2026-07-11T21:52:45"
"Best AI Tools for Customer Service in 2026","AI","ai","https://saasstatshub.com/ai/best-ai-tools-for-customer-service/","2026-07-11T21:52:44"
"Best AI Tools for Developers in 2026","AI","ai","https://saasstatshub.com/ai/best-ai-tools-for-developers/","2026-07-11T21:52:41"
"Best AI Tools for HR in 2026","AI","ai","https://saasstatshub.com/ai/best-ai-tools-for-hr/","2026-07-11T21:52:38"
"Best AI Tools for Marketing in 2026","AI","ai","https://saasstatshub.com/ai/best-ai-tools-for-marketing/","2026-07-11T21:52:37"
"Best AI Tools for Sales in 2026","AI","ai","https://saasstatshub.com/ai/best-ai-tools-for-sales/","2026-07-11T21:52:36"
"Best AI Video Generation in 2026","AI","ai","https://saasstatshub.com/ai/best-ai-video-generation-tools/","2026-07-11T22:09:31"
"Best AI Writing Tools in 2026","AI","ai","https://saasstatshub.com/ai/best-ai-writing-tools/","2026-07-11T22:11:30"
"Best AI Writing Tools in 2027: Latest Models Compared","AI","ai","https://saasstatshub.com/ai/best-ai-writing-tools-2027/","2026-07-11T21:52:35"
"Best Free AI Tools for Business 2026","AI","ai","https://saasstatshub.com/ai/free-ai-tools-for-business-2026/","2026-07-11T21:58:30"
"ChatGPT vs Claude: Which Is Better in 2026?","AI","ai","https://saasstatshub.com/ai/chatgpt-vs-claude/","2026-07-11T22:45:19"
"ChatGPT vs Gemini: Which Is Better in 2026?","AI","ai","https://saasstatshub.com/ai/chatgpt-vs-gemini/","2026-07-11T22:46:09"
"Claude vs ChatGPT: Which Is Better in 2026?","AI","ai","https://saasstatshub.com/ai/claude-vs-chatgpt/","2026-07-11T22:45:18"
"Cursor vs GitHub Copilot: Which Is Better in 2026?","AI","ai","https://saasstatshub.com/ai/cursor-vs-github-copilot/","2026-07-11T22:45:11"
"GitHub Copilot vs ChatGPT: Which Is Better in 2026?","AI","ai","https://saasstatshub.com/ai/copilot-vs-chatgpt/","2026-07-11T22:45:13"
"How ChatGPT Works: Explained","AI","ai","https://saasstatshub.com/ai/how-chatgpt-works-explained/","2026-07-11T21:57:36"
"How to Build AI Workflow in 2026: A Complete Guide","AI","ai","https://saasstatshub.com/ai/how-to-build-ai-workflow/","2026-07-11T22:07:55"
"How to Build RAG Application in 2026: A Complete Guide","AI","ai","https://saasstatshub.com/ai/how-to-build-rag-application/","2026-07-11T22:07:48"
"How to Choose AI Writing Tool in 2026: A Complete Guide","AI","ai","https://saasstatshub.com/ai/how-to-choose-ai-writing-tool/","2026-07-11T22:10:50"
"How to Deploy AI Chatbot in 2026: A Complete Guide","AI","ai","https://saasstatshub.com/ai/how-to-deploy-ai-chatbot/","2026-07-11T22:10:40"
"How to Fine-Tune LLM in 2026: A Complete Guide","AI","ai","https://saasstatshub.com/ai/how-to-fine-tune-llm/","2026-07-11T22:07:30"
"How to Implement AI Cybersecurity in 2026: A Complete Guide","AI","ai","https://saasstatshub.com/ai/how-to-implement-ai-cybersecurity/","2026-07-11T22:07:26"
"How to Implement AI in Business in 2026: A Complete Guide","AI","ai","https://saasstatshub.com/ai/how-to-implement-ai-in-business/","2026-07-11T22:07:25"
"How to Implement AI Recruiting in 2026: A Complete Guide","AI","ai","https://saasstatshub.com/ai/how-to-implement-ai-recruiting/","2026-07-11T22:10:38"
"How to Integrate AI into Workflow in 2026: A Complete Guide","AI","ai","https://saasstatshub.com/ai/how-to-integrate-ai-into-workflow/","2026-07-11T22:10:30"
"How to Use AI for Content Marketing in 2026: A Complete Guide","AI","ai","https://saasstatshub.com/ai/how-to-use-ai-content-marketing/","2026-07-11T22:10:23"
"How to Use AI for Customer Service in 2026: A Complete Guide","AI","ai","https://saasstatshub.com/ai/how-to-use-ai-for-customer-service/","2026-07-11T22:06:44"
"How to Use AI for Data Analysis in 2026: A Complete Guide","AI","ai","https://saasstatshub.com/ai/how-to-use-ai-data-analysis/","2026-07-11T22:10:22"
"How to Use AI for Sales in 2026: A Complete Guide","AI","ai","https://saasstatshub.com/ai/how-to-use-ai-for-sales/","2026-07-11T22:10:21"
"How to Use AI for SEO in 2026: A Complete Guide","AI","ai","https://saasstatshub.com/ai/how-to-use-ai-for-seo/","2026-07-11T22:06:43"
"How to Use AI Image Generation in 2026: A Complete Guide","AI","ai","https://saasstatshub.com/ai/how-to-use-ai-image-generation/","2026-07-11T22:10:20"
"Machine Learning Platforms: Compared","AI","ai","https://saasstatshub.com/ai/machine-learning-platforms/","2026-07-11T21:56:33"
"Midjourney vs DALL-E: Which Is Better in 2026?","AI","ai","https://saasstatshub.com/ai/midjourney-vs-dall-e/","2026-07-11T22:44:54"
"Perplexity vs ChatGPT: Which Is Better in 2026?","AI","ai","https://saasstatshub.com/ai/perplexity-vs-chatgpt/","2026-07-11T22:44:47"
"The Ultimate Guide to Artificial Intelligence Software in 2026","AI","ai","https://saasstatshub.com/ai/artificial-intelligence-guide/","2026-07-11T21:52:52"
"What Is AI Bias?","AI","ai","https://saasstatshub.com/ai/what-is-ai-bias/","2026-07-11T21:50:04"
"What Is AI Ethics?","AI","ai","https://saasstatshub.com/ai/what-is-ai-ethics/","2026-07-11T21:50:02"
"What Is AI Explainability?","AI","ai","https://saasstatshub.com/ai/what-is-ai-explainability/","2026-07-11T21:50:01"
"What Is AI Governance?","AI","ai","https://saasstatshub.com/ai/what-is-ai-governance/","2026-07-11T21:50:00"
"What Is AI in Customer Service?","AI","ai","https://saasstatshub.com/ai/what-is-ai-in-customer-service/","2026-07-11T21:49:58"
"What Is AI in Finance?","AI","ai","https://saasstatshub.com/ai/what-is-ai-in-finance/","2026-07-11T21:49:57"
"What Is AI in Healthcare?","AI","ai","https://saasstatshub.com/ai/what-is-ai-in-healthcare/","2026-07-11T21:49:56"
"What Is AI in Marketing?","AI","ai","https://saasstatshub.com/ai/what-is-ai-in-marketing/","2026-07-11T21:49:55"
"What Is AI in Sales?","AI","ai","https://saasstatshub.com/ai/what-is-ai-in-sales/","2026-07-11T21:49:54"
"What Is AI-Powered Analytics?","AI","ai","https://saasstatshub.com/ai/what-is-ai-powered-analytics/","2026-07-11T21:49:53"
"What Is AI-Powered Automation?","AI","ai","https://saasstatshub.com/ai/what-is-ai-powered-automation/","2026-07-11T21:49:51"
"What Is AI-Powered Search?","AI","ai","https://saasstatshub.com/ai/what-is-ai-powered-search/","2026-07-11T21:49:51"
"What Is Artificial Intelligence?","AI","ai","https://saasstatshub.com/ai/what-is-artificial-intelligence/","2026-07-11T21:49:47"
"What Is Chatbot?","AI","ai","https://saasstatshub.com/ai/what-is-chatbot/","2026-07-11T21:49:17"
"What Is Computer Vision AI?","AI","ai","https://saasstatshub.com/ai/what-is-computer-vision-ai/","2026-07-11T21:48:57"
"What Is Computer Vision?","AI","ai","https://saasstatshub.com/ai/what-is-computer-vision/","2026-07-11T21:48:56"
"What Is Conversational AI?","AI","ai","https://saasstatshub.com/ai/what-is-conversational-ai/","2026-07-11T21:48:31"
"What Is Deep Learning?","AI","ai","https://saasstatshub.com/ai/what-is-deep-learning/","2026-07-11T21:47:38"
"What Is Edge AI?","AI","ai","https://saasstatshub.com/ai/what-is-edge-ai/","2026-07-11T21:47:03"
"What Is Generative AI and How Can Businesses Use It?","AI","ai","https://saasstatshub.com/ai/what-is-generative-ai-and-how-can-businesses-use-it/","2026-07-11T21:53:10"
"What Is Generative AI?","AI","ai","https://saasstatshub.com/ai/what-is-generative-ai/","2026-07-11T21:46:14"
"What Is Machine Learning?","AI","ai","https://saasstatshub.com/ai/what-is-machine-learning/","2026-07-11T21:44:46"
"What Is MLOps?","AI","ai","https://saasstatshub.com/ai/what-is-mlops/","2026-07-11T21:44:19"
"What Is NLP?","AI","ai","https://saasstatshub.com/ai/what-is-nlp/","2026-07-11T21:44:11"
"What Is RPA?","AI","ai","https://saasstatshub.com/ai/what-is-rpa/","2026-07-11T21:42:20"
"What Is Voice AI?","AI","ai","https://saasstatshub.com/ai/what-is-voice-ai/","2026-07-11T21:40:52"
"Windsurf vs Cursor: Which Is Better in 2026?","AI","ai","https://saasstatshub.com/ai/windsurf-vs-cursor/","2026-07-11T22:44:28"
"3 Best Mixpanel Alternatives for 2026","Analytics","analytics","https://saasstatshub.com/analytics/mixpanel-alternatives/","2026-07-11T21:39:49"
"3 Best Power BI Alternatives for 2026","Analytics","analytics","https://saasstatshub.com/analytics/power-bi-alternatives/","2026-07-11T22:42:42"
"4 Best Google Analytics Alternatives for 2026","Analytics","analytics","https://saasstatshub.com/analytics/google-analytics-alternatives/","2026-07-11T21:40:04"
"4 Best Tableau Alternatives for 2026","Analytics","analytics","https://saasstatshub.com/analytics/tableau-alternatives/","2026-07-11T21:39:25"
"AI SaaS Statistics 2026: Spending, Adoption and Enterprise Scale","Analytics","analytics","https://saasstatshub.com/analytics/ai-saas-statistics-2026/","2026-07-12T07:47:41"
"Amplitude vs Mixpanel: Which Product Analytics Platform Is Better in 2026?","Analytics","analytics","https://saasstatshub.com/analytics/amplitude-vs-mixpanel/","2026-07-11T22:13:30"
"Analytics for Small Business: Getting Started","Analytics","analytics","https://saasstatshub.com/analytics/analytics-for-small-business/","2026-07-11T22:01:39"
"Artificial Intelligence Statistics 2026: Global Market Size, Enterprise Adoption, and Spending Trends","Analytics","analytics","https://saasstatshub.com/analytics/artificial-intelligence-statistics-2026/","2026-07-11T22:14:13"
"Best AI Tools for Data Analysis in 2026","Analytics","analytics","https://saasstatshub.com/analytics/best-ai-tools-for-data-analysis/","2026-07-11T21:52:42"
"Best Analytics Tools in 2026","Analytics","analytics","https://saasstatshub.com/analytics/best-analytics-tools/","2026-07-11T22:13:25"
"Best BI Tools in 2026","Analytics","analytics","https://saasstatshub.com/analytics/best-bi-software-2026/","2026-07-11T22:13:24"
"Best Business Intelligence Tools 2026","Analytics","analytics","https://saasstatshub.com/analytics/best-bi-tools/","2026-07-17T22:33:07"
"Best CDP in 2026","Analytics","analytics","https://saasstatshub.com/analytics/best-customer-data-platforms/","2026-07-11T22:13:16"
"Best Customer Data Platform in 2026","Analytics","analytics","https://saasstatshub.com/analytics/best-customer-data-platform-tools/","2026-07-11T22:09:14"
"Best Data Catalog in 2026","Analytics","analytics","https://saasstatshub.com/analytics/best-data-catalog-tools/","2026-07-11T22:09:13"
"Best Data Integration in 2026","Analytics","analytics","https://saasstatshub.com/analytics/best-data-integration-tools/","2026-07-11T22:09:11"
"Best Data Mesh in 2026","Analytics","analytics","https://saasstatshub.com/analytics/best-data-mesh-platforms/","2026-07-11T22:09:10"
"Best Data Visualization Tools in 2026","Analytics","analytics","https://saasstatshub.com/analytics/best-data-visualization-tools/","2026-07-11T22:13:14"
"Best Free Analytics Tools in 2026","Analytics","analytics","https://saasstatshub.com/analytics/free-analytics-tools-2026/","2026-07-11T21:58:29"
"Best Low Code in 2026","Analytics","analytics","https://saasstatshub.com/analytics/best-low-code-platforms/","2026-07-11T22:08:48"
"Best No Code Platforms in 2026","Analytics","analytics","https://saasstatshub.com/analytics/best-no-code-platforms/","2026-07-11T22:11:11"
"Best SaaS Analytics in 2026","Analytics","analytics","https://saasstatshub.com/analytics/best-saas-analytics-tools/","2026-07-11T22:08:37"
"BI Tools for Startups: Best Options","Analytics","analytics","https://saasstatshub.com/analytics/bi-tools-for-startups/","2026-07-11T22:01:18"
"BI vs Analytics: What’s the Difference?","Analytics","analytics","https://saasstatshub.com/analytics/bi-vs-analytics-whats-the-difference/","2026-07-11T22:01:17"
"Big Data Statistics 2026: Analytics Market Size, Data Volume Growth, and Enterprise Spending","Analytics","analytics","https://saasstatshub.com/analytics/big-data-statistics-2026/","2026-07-11T22:14:12"
"Business Intelligence Statistics 2026: Platform Data and Source Limits","Analytics","analytics","https://saasstatshub.com/analytics/business-intelligence-statistics-2026/","2026-07-11T22:14:52"
"Cloud Computing Statistics 2026: Infrastructure Spending and Market Share","Analytics","analytics","https://saasstatshub.com/analytics/cloud-computing-statistics-2026/","2026-07-11T22:18:28"
"Data Visualization Tools Comparison","Analytics","analytics","https://saasstatshub.com/analytics/data-visualization-tools-comparison/","2026-07-11T21:59:46"
"Data Warehousing: Implementation Guide","Analytics","analytics","https://saasstatshub.com/analytics/data-warehousing-guide/","2026-07-11T21:59:44"
"Datadog vs Splunk: Which Monitoring Platform Is Better in 2026?","Analytics","analytics","https://saasstatshub.com/analytics/datadog-vs-splunk/","2026-07-11T22:12:47"
"How to Automate Business Processes in 2026: A Complete Guide","Analytics","analytics","https://saasstatshub.com/analytics/how-to-automate-business-processes/","2026-07-11T22:10:56"
"How to Build a Data Dashboard in 2026","Analytics","analytics","https://saasstatshub.com/analytics/how-to-build-data-dashboard/","2026-07-11T22:12:43"
"How to Build Data Catalog in 2026: A Complete Guide","Analytics","analytics","https://saasstatshub.com/analytics/how-to-build-data-catalog/","2026-07-11T22:07:54"
"How to Build Data Pipeline in 2026: A Complete Guide","Analytics","analytics","https://saasstatshub.com/analytics/how-to-build-data-pipeline/","2026-07-11T22:07:52"
"How to Build No Code App in 2026: A Complete Guide","Analytics","analytics","https://saasstatshub.com/analytics/how-to-build-no-code-app/","2026-07-11T22:10:52"
"How to Calculate LTV and CAC in 2026","Analytics","analytics","https://saasstatshub.com/analytics/how-to-calculate-ltv-cac/","2026-07-11T22:12:39"
"How to Choose a BI Tool in 2026","Analytics","analytics","https://saasstatshub.com/analytics/how-to-choose-bi-tool/","2026-07-11T22:12:37"
"How to Choose CDP in 2026: A Complete Guide","Analytics","analytics","https://saasstatshub.com/analytics/how-to-choose-customer-data-platform/","2026-07-11T22:07:40"
"How to Choose Low Code Platform in 2026: A Complete Guide","Analytics","analytics","https://saasstatshub.com/analytics/how-to-choose-low-code-platform/","2026-07-11T22:07:37"
"How to Evaluate a SaaS Vendor in 2026","Analytics","analytics","https://saasstatshub.com/analytics/how-to-evaluate-saas-vendor/","2026-07-11T22:12:24"
"How to Implement Data Warehouse in 2026: A Complete Guide","Analytics","analytics","https://saasstatshub.com/analytics/how-to-implement-data-warehouse/","2026-07-11T22:07:21"
"How to Implement Real-Time Analytics in 2026: A Complete Guide","Analytics","analytics","https://saasstatshub.com/analytics/how-to-implement-real-time-analytics/","2026-07-11T22:07:12"
"How to Reduce Churn in 2026: Proven Strategies","Analytics","analytics","https://saasstatshub.com/analytics/how-to-reduce-churn/","2026-07-11T22:12:14"
"How to Scale a SaaS Business in 2026","Analytics","analytics","https://saasstatshub.com/analytics/how-to-scale-saas/","2026-07-11T22:12:11"
"KPI Dashboard Design Guide","Analytics","analytics","https://saasstatshub.com/analytics/kpi-dashboard-design-guide/","2026-07-11T21:56:54"
"KPI Dashboard: Template and Guide","Analytics","analytics","https://saasstatshub.com/analytics/kpi-dashboard-template/","2026-07-11T21:56:52"
"Marketing Analytics: Platforms Compared","Analytics","analytics","https://saasstatshub.com/analytics/marketing-analytics-platforms/","2026-07-11T21:56:31"
"Mixpanel vs Amplitude vs Google Analytics 2026","Analytics","analytics","https://saasstatshub.com/analytics/mixpanel-vs-amplitude-vs-google-analytics/","2026-07-17T22:33:05"
"Mixpanel vs Amplitude: Which Is Better in 2026?","Analytics","analytics","https://saasstatshub.com/analytics/mixpanel-vs-amplitude/","2026-07-11T22:44:52"
"Predictive Analytics: Getting Started","Analytics","analytics","https://saasstatshub.com/analytics/predictive-analytics-guide/","2026-07-11T21:55:40"
"Product Analytics: Essential Tools","Analytics","analytics","https://saasstatshub.com/analytics/product-analytics-tools/","2026-07-11T21:55:39"
"Real-Time Analytics: Tools and Use Cases","Analytics","analytics","https://saasstatshub.com/analytics/real-time-analytics-tools/","2026-07-11T21:55:12"
"SaaS Buying Guide: How to Evaluate and Purchase Software in 2026","Analytics","analytics","https://saasstatshub.com/analytics/saas-buying-guide/","2026-07-11T22:11:57"
"SaaS Churn Rate Statistics 2026: Retention, NRR & GRR Benchmarks","Analytics","analytics","https://saasstatshub.com/analytics/saas-churn-rate-statistics-2026/","2026-07-11T22:15:03"
"SaaS Funding Statistics 2026: Venture Capital Sources and Disclosure Limits","Analytics","analytics","https://saasstatshub.com/analytics/saas-funding-statistics-2026/","2026-07-11T22:15:02"
"SaaS Market Statistics 2026: Software Spending and Public Company Indicators","Analytics","analytics","https://saasstatshub.com/analytics/saas-market-size-statistics-2026/","2026-07-11T22:18:31"
"SaaS Onboarding Statistics 2026: Adoption, Retention and Measurement Data","Analytics","analytics","https://saasstatshub.com/analytics/saas-onboarding-statistics-2026/","2026-07-11T22:15:01"
"SaaS Pricing Trends 2027","Analytics","analytics","https://saasstatshub.com/analytics/saas-pricing-trends-2027/","2026-07-11T21:54:50"
"SaaS vs On-Premise Statistics 2026: Cloud Adoption, Spend and Workload Trends","Analytics","analytics","https://saasstatshub.com/analytics/saas-vs-on-premise-statistics-2026/","2026-07-11T22:14:58"
"Segment vs Rudderstack: Which Is Better in 2026?","Analytics","analytics","https://saasstatshub.com/analytics/segment-vs-rudderstack/","2026-07-11T22:44:39"
"Snowflake vs Databricks: Which Is Better in 2026?","Analytics","analytics","https://saasstatshub.com/analytics/snowflake-vs-databricks/","2026-07-11T22:44:34"
"State of SaaS 2026: Market Trends, Buyers and Cloud Operations","Analytics","analytics","https://saasstatshub.com/analytics/state-of-saas-2026-annual-report/","2026-07-12T07:47:46"
"State of SaaS 2027: Annual Industry Report","Analytics","analytics","https://saasstatshub.com/analytics/state-of-saas-2027-annual-report/","2026-07-11T21:50:19"
"Tableau vs Looker: Which Is Better in 2026?","Analytics","analytics","https://saasstatshub.com/analytics/tableau-vs-looker/","2026-07-11T22:44:31"
"Tableau vs Power BI: Which Is Better in 2026?","Analytics","analytics","https://saasstatshub.com/analytics/tableau-vs-power-bi/","2026-07-11T22:45:41"
"The Complete SaaS Glossary: 200+ Terms","Analytics","analytics","https://saasstatshub.com/analytics/complete-saas-glossary/","2026-07-11T22:13:35"
"The Ultimate Guide to Data Analytics Software in 2026","Analytics","analytics","https://saasstatshub.com/analytics/data-analytics-guide/","2026-07-11T21:50:39"
"What Is A/B Testing?","Analytics","analytics","https://saasstatshub.com/analytics/what-is-a-b-testing/","2026-07-11T21:50:17"
"What Is Business Analytics?","Analytics","analytics","https://saasstatshub.com/analytics/what-is-business-analytics/","2026-07-11T21:49:34"
"What Is Business Intelligence (BI) and How Does It Work?","Analytics","analytics","https://saasstatshub.com/analytics/what-is-business-intelligence-bi-and-how-does-it-work/","2026-07-11T21:53:17"
"What Is Business Intelligence?","Analytics","analytics","https://saasstatshub.com/analytics/what-is-business-intelligence/","2026-07-11T21:49:33"
"What Is Cohort Analysis?","Analytics","analytics","https://saasstatshub.com/analytics/what-is-cohort-analysis/","2026-07-11T21:49:06"
"What Is Customer Analytics?","Analytics","analytics","https://saasstatshub.com/analytics/what-is-customer-analytics/","2026-07-11T21:48:17"
"What Is Dashboard?","Analytics","analytics","https://saasstatshub.com/analytics/what-is-dashboard/","2026-07-11T21:47:59"
"What Is Data Analytics?","Analytics","analytics","https://saasstatshub.com/analytics/what-is-data-analytics/","2026-07-11T21:47:58"
"What Is Data Ethics?","Analytics","analytics","https://saasstatshub.com/analytics/what-is-data-ethics/","2026-07-11T21:47:54"
"What Is Data Governance?","Analytics","analytics","https://saasstatshub.com/analytics/what-is-data-governance/","2026-07-11T21:47:53"
"What Is Data Lake?","Analytics","analytics","https://saasstatshub.com/analytics/what-is-data-lake/","2026-07-11T21:47:52"
"What Is Data Literacy?","Analytics","analytics","https://saasstatshub.com/analytics/what-is-data-literacy/","2026-07-11T21:47:50"
"What Is Data Migration?","Analytics","analytics","https://saasstatshub.com/analytics/what-is-data-migration/","2026-07-11T21:47:48"
"What Is Data Pipeline?","Analytics","analytics","https://saasstatshub.com/analytics/what-is-data-pipeline/","2026-07-11T21:47:46"
"What Is Data Quality?","Analytics","analytics","https://saasstatshub.com/analytics/what-is-data-quality/","2026-07-11T21:47:45"
"What Is Data Storytelling?","Analytics","analytics","https://saasstatshub.com/analytics/what-is-data-storytelling/","2026-07-11T21:47:44"
"What Is Data Visualization?","Analytics","analytics","https://saasstatshub.com/analytics/what-is-data-visualization/","2026-07-11T21:47:43"
"What Is Data Warehouse?","Analytics","analytics","https://saasstatshub.com/analytics/what-is-data-warehouse/","2026-07-11T21:47:41"
"What Is Data-Driven Decision Making?","Analytics","analytics","https://saasstatshub.com/analytics/what-is-data-driven-decision-making/","2026-07-11T21:47:57"
